Kec. Lowokwaru Kota Malang,25,7,0,0,0,32
Kec. Manguharjo Kota Madiun,7,1,0,0,0,8
Kec. Taman Kota Madiun,6,4,0,0,0,10
Kec. Kartoharjo Kota Madiun,8,2,0,0,0,10
Kec. Mojoroto Kota Kediri,18,12,0,0,0,30
Kec. Kota Kediri Kota Kediri,10,2,0,0,0,12
Kec. Pesantren Kota Kediri,2,0,0,0,0,2
Kec. Prajurit Kulon Kota Mojokerto,9,3,0,0,0,12
Kec. Magersari Kota Mojokerto,13,1,0,0,0,14
Kec. Sukorejo Kota Blitar,3,1,0,0,0,4
Kec. Kepanjenkidul Kota Blitar,12,2,0,0,0,14
Kec. Sananwetan Kota Blitar,10,2,0,0,0,12
Kec. Gadingrejo Kota Pasuruan,2,0,0,0,0,2
Kec. Purworejo Kota Pasuruan,3,1,0,0,0,4
Kec. Bugul Kidul Kota Pasuruan,6,0,0,0,0,6
Kec. Panggungrejo Kota Pasuruan,6,2,0,0,0,8
Kec. Kademangan Kota Probolinggo,4,0,0,0,0,4
Kec. Wonoasih Kota Probolinggo,2,0,0,0,0,2
Kec. Mayangan Kota Probolinggo,4,0,0,0,0,4
Kec. Kanigaran Kota Probolinggo,8,2,0,0,0,10
Kec. Batu Kota Batu,11,3,0,0,0,14
Kec. Junrejo Kota Batu,2,0,0,0,0,2
Kec. Bumiaji Kota Batu,4,0,0,0,0,4
Kec. Kenduruan Kab. Tuban,0,0,0,0,0,0
Kec. Bangilan Kab. Tuban,2,0,0,0,0,2
Kec. Senori Kab. Tuban,2,0,0,0,0,2
Kec. Singgahan Kab. Tuban,1,1,0,0,0,2
Kec. Montong Kab. Tuban,2,0,0,0,0,2
Kec. Parengan Kab. Tuban,0,2,0,0,0,2
Kec. Soko Kab. Tuban,2,2,0,0,0,4
Kec. Rengel Kab. Tuban,2,0,0,0,0,2
Kec. Plumpang Kab. Tuban,3,1,0,0,0,4
Kec. Widang Kab. Tuban,0,0,0,0,0,0
Kec. Palang Kab. Tuban,1,1,0,0,0,2
Kec. Semanding Kab. Tuban,7,0,0,0,0,7
Kec. Tuban Kab. Tuban,13,1,0,0,0,14
Kec. Jenu Kab. Tuban,0,0,0,0,0,0
Kec. Kerek Kab. Tuban,0,0,0,0,0,0
Kec. Tambakboyo Kab. Tuban,0,2,0,0,0,2
Kec. Jatirogo Kab. Tuban,2,0,0,0,0,2
Kec. Bancar Kab. Tuban,1,3,0,0,0,4
Kec. Grabagan Kab. Tuban,0,0,0,0,0,0
Kec. Berbek Kab. Nganjuk,1,1,0,0,0,2
Kec. Loceret Kab. Nganjuk,3,1,0,0,0,4
Kec. Pace Kab. Nganjuk,0,0,0,0,0,0
Kec. Tanjunganom Kab. Nganjuk,7,3,0,0,0,10
Kec. Prambon Kab. Nganjuk,2,0,0,0,0,2
Kec. Ngronggot Kab. Nganjuk,0,0,0,0,0,0
Kec. Kertosono Kab. Nganjuk,4,2,0,0,0,6
Kec. Patianrowo Kab. Nganjuk,6,0,0,0,0,6
Kec. Baron Kab. Nganjuk,1,1,0,0,0,2
Kec. Gondang Kab. Nganjuk,4,0,0,0,0,4
Kec. Sukomoro Kab. Nganjuk,1,1,0,0,0,2
Kec. Nganjuk Kab. Nganjuk,7,3,0,0,0,10
Kec. Rejoso Kab. Nganjuk,2,0,0,0,0,2
Kec. Lengkong Kab. Nganjuk,0,0,0,0,0,0
Kec. Kencong Kab. Jember,1,3,0,0,0,4
Kec. Gumuk Mas Kab. Jember,1,1,0,0,0,2
Kec. Puger Kab. Jember,0,0,0,0,0,0
Kec. Wuluhan Kab. Jember,2,0,0,0,0,2
Kec. Ambulu Kab. Jember,7,1,0,0,0,8
Kec. Tempurejo Kab. Jember,2,0,0,0,0,2
Kec. Silo Kab. Jember,0,0,0,0,0,0
Kec. Mayang Kab. Jember,1,1,0,0,0,2
Kec. Mumbulsari Kab. Jember,4,0,0,0,0,4
Kec. Jenggawah Kab. Jember,2,0,0,0,0,2
Kec. Rambipuji Kab. Jember,6,2,0,0,0,8
Kec. Balung Kab. Jember,3,1,0,0,0,4
Kec. Umbulsari Kab. Jember,2,0,0,0,0,2
Kec. Semboro Kab. Jember,2,0,0,0,0,2
Kec. Jombang Kab. Jember,1,1,0,0,0,2
Kec. Sumberbaru Kab. Jember,0,0,0,0,0,0
Kec. Tanggul Kab. Jember,2,2,0,0,0,4
Kec. Bangsalsari Kab. Jember,0,0,0,0,0,0
Kec. Panti Kab. Jember,1,1,0,0,0,2
Kec. Arjasa Kab. Jember,1,1,0,0,0,2
Kec. Pakusari Kab. Jember,2,0,0,0,0,2
Kec. Kalisat Kab. Jember,3,1,0,0,0,4
Kec. Sumberjambe Kab. Jember,1,1,0,0,0,2
Kec. Sukowono Kab. Jember,3,1,0,0,0,4
Kec. Jelbuk Kab. Jember,0,0,0,0,0,0
Kec. Kaliwates Kab. Jember,6,9,0,0,0,15
Kec. Sumbersari Kab. Jember,12,6,0,0,0,18
Kec. Patrang Kab. Jember,4,2,0,0,0,6
Kec. Pesanggaran Kab. Banyuwangi,2,0,0,0,0,2
Kec. Bangorejo Kab. Banyuwangi,1,1,0,0,0,2
Kec. Purwoharjo Kab. Banyuwangi,4,2,0,0,0,6
Kec. Tegaldlimo Kab. Banyuwangi,2,0,0,0,0,2
Kec. Muncar Kab. Banyuwangi,3,1,0,0,0,4
Kec. Cluring Kab. Banyuwangi,1,1,0,0,0,2
Kec. Gambiran Kab. Banyuwangi,3,1,0,0,0,4
Kec. Glenmore Kab. Banyuwangi,4,4,0,0,0,8
Kec. Kalibaru Kab. Banyuwangi,0,0,0,0,0,0
Kec. Genteng Kab. Banyuwangi,11,3,0,0,0,14
Kec. Srono Kab. Banyuwangi,5,3,0,0,0,8
Kec. Rogojampi Kab. Banyuwangi,0,4,0,0,0,4
Kec. Kabat Kab. Banyuwangi,1,1,0,0,0,2
Kec. Singojuruh Kab. Banyuwangi,4,0,0,0,0,4
Kec. Sempu Kab. Banyuwangi,0,0,0,0,0,0
Kec. Songgon Kab. Banyuwangi,2,2,0,0,0,4
Kec. Glagah Kab. Banyuwangi,1,1,0,0,0,2
Kec. Banyuwangi Kab. Banyuwangi,7,3,0,0,0,10
Kec. Giri Kab. Banyuwangi,4,0,0,0,0,4
Kec. Kalipuro Kab. Banyuwangi,2,0,0,0,0,2
Kec. Wongsorejo Kab. Banyuwangi,3,1,0,0,0,4
Kec. Tegalsari Kab. Banyuwangi,0,0,0,0,0,0
Kec. Siliragung Kab. Banyuwangi,1,1,0,0,0,2
Kec. Punung Kab. Pacitan,2,0,0,0,0,2
Kec. Pacitan Kab. Pacitan,4,0,0,0,0,4
Kec. Nawangan Kab. Pacitan,4,0,0,0,0,4
Kec. Bandar Kab. Pacitan,0,0,0,0,0,0
Kec. Tegalombo Kab. Pacitan,1,1,0,0,0,2
Kec. Tulakan Kab. Pacitan,2,0,0,0,0,2
Kec. Ngadirojo Kab. Pacitan,0,2,0,0,0,2
Kec. Sudimoro Kab. Pacitan,0,0,0,0,0,0
Kec. Kras Kab. Kediri,2,0,0,0,0,2
Kec. Kepung Kab. Kediri,4,0,0,0,0,4
Kec. Puncu Kab. Kediri,0,0,0,0,0,0
Kec. Plosoklaten Kab. Kediri,0,0,0,0,0,0
Kec. Wates Kab. Kediri,3,1,0,0,0,4
Kec. Kandat Kab. Kediri,0,4,0,0,0,4
Kec. Ngadiluwih Kab. Kediri,1,1,0,0,0,2
Kec. Mojo Kab. Kediri,2,2,0,0,0,4
Kec. Semen Kab. Kediri,0,0,0,0,0,0
Kec. Tarokan Kab. Kediri,2,0,0,0,0,2
Kec. Grogol Kab. Kediri,4,0,0,0,0,4
Kec. Gurah Kab. Kediri,2,0,0,0,0,2
Kec. Papar Kab. Kediri,2,0,0,0,0,2
Kec. Plemahan Kab. Kediri,3,1,0,0,0,4
Kec. Purwoasri Kab. Kediri,2,0,0,0,0,2
Kec. Pare Kab. Kediri,8,2,0,0,0,10
Kec. Kandangan Kab. Kediri,0,2,0,0,0,2
Kec. Badas Kab. Kediri,0,0,0,0,0,0
Kec. Tempursari Kab. Lumajang,4,0,0,0,0,4
Kec. Pronojiwo Kab. Lumajang,2,0,0,0,0,2
Kec. Candipuro Kab. Lumajang,4,0,0,0,0,4
Kec. Pasirian Kab. Lumajang,2,0,0,0,0,2
Kec. Tempeh Kab. Lumajang,6,0,0,0,0,6
Kec. Kunir Kab. Lumajang,3,1,0,0,0,4
Kec. Yosowilangun Kab. Lumajang,3,1,0,0,0,4
Kec. Tekung Kab. Lumajang,2,0,0,0,0,2
Kec. Lumajang Kab. Lumajang,19,1,0,0,0,20
Kec. Senduro Kab. Lumajang,0,0,0,0,0,0
Kec. Jatiroto Kab. Lumajang,2,0,0,0,0,2
Kec. Randuagung Kab. Lumajang,0,0,0,0,0,0
Kec. Klakah Kab. Lumajang,1,1,0,0,0,2
Kec. Ranuyoso Kab. Lumajang,0,0,0,0,0,0
Kec. Grujugan Kab. Bondowoso,2,0,0,0,0,2
Kec. Tamanan Kab. Bondowoso,1,1,0,0,0,2
Kec. Pujer Kab. Bondowoso,2,0,0,0,0,2
Kec. Tlogosari Kab. Bondowoso,0,0,0,0,0,0
Kec. Sukosari Kab. Bondowoso,1,1,0,0,0,2
Kec. Tapen Kab. Bondowoso,2,0,0,0,0,2
Kec. Tenggarang Kab. Bondowoso,1,1,0,0,0,2
Kec. Bondowoso Kab. Bondowoso,7,3,0,0,0,10
Kec. Curahdami Kab. Bondowoso,0,2,0,0,0,2
Kec. Wringin Kab. Bondowoso,3,1,0,0,0,4
Kec. Prajekan Kab. Bondowoso,0,2,0,0,0,2
Kec. Cermee Kab. Bondowoso,0,0,0,0,0,0
Kec. Sumber Wringin Kab. Bondowoso,1,1,0,0,0,2
Kec. Jambesari Darus Sholah Kab. Bondowoso,0,0,0,0,0,0
Kec. Botolinggo Kab. Bondowoso,0,2,0,0,0,2
Kec. Banyuglugur Kab. Situbondo,1,1,0,0,0,2
Kec. Besuki Kab. Situbondo,2,0,0,0,0,2
Kec. Suboh Kab. Situbondo,1,1,0,0,0,2
Kec. Panarukan Kab. Situbondo,0,0,0,0,0,0
Kec. Situbondo Kab. Situbondo,1,3,0,0,0,4
Kec. Panji Kab. Situbondo,6,2,0,0,0,8
Kec. Kapongan Kab. Situbondo,2,0,0,0,0,2
Kec. Arjasa Kab. Situbondo,2,0,0,0,0,2
Kec. Asembagus Kab. Situbondo,1,1,0,0,0,2
Kec. Banyuputih Kab. Situbondo,9,1,0,0,0,10
Kec. Jatirejo Kab. Mojokerto,3,1,0,0,0,4
Kec. Gondang Kab. Mojokerto,6,0,0,0,0,6
Kec. Pacet Kab. Mojokerto,5,3,0,0,0,8
Kec. Trawas Kab. Mojokerto,2,0,0,0,0,2
Kec. Ngoro Kab. Mojokerto,6,0,0,0,0,6
Kec. Pungging Kab. Mojokerto,1,1,0,0,0,2
Kec. Kutorejo Kab. Mojokerto,4,0,0,0,0,4
Kec. Mojosari Kab. Mojokerto,7,1,0,0,0,8
Kec. Bangsal Kab. Mojokerto,2,0,0,0,0,2
Kec. Dlanggu Kab. Mojokerto,2,0,0,0,0,2
Kec. Puri Kab. Mojokerto,3,7,0,0,0,10
Kec. Trowulan Kab. Mojokerto,0,0,0,0,0,0
Kec. Sooko Kab. Mojokerto,3,1,0,0,0,4
Kec. Gedeg Kab. Mojokerto,4,2,0,0,0,6
Kec. Kemlagi Kab. Mojokerto,2,0,0,0,0,2
Kec. Jetis Kab. Mojokerto,1,1,0,0,0,2
Kec. Dawar Blandong Kab. Mojokerto,3,1,0,0,0,4
Kec. Mojoanyar Kab. Mojokerto,0,0,0,0,0,0
Kec. Sine Kab. Ngawi,2,0,0,0,0,2
Kec. Ngrambe Kab. Ngawi,1,1,0,0,0,2
Kec. Jogorogo Kab. Ngawi,3,1,0,0,0,4
Kec. Kendal Kab. Ngawi,0,0,0,0,0,0
Kec. Geneng Kab. Ngawi,12,0,0,0,0,12
Kec. Kwadungan Kab. Ngawi,2,0,0,0,0,2
Kec. Karangjati Kab. Ngawi,1,1,0,0,0,2
Kec. Ngawi Kab. Ngawi,5,1,0,0,0,6
Kec. Paron Kab. Ngawi,3,1,0,0,0,4
Kec. Kedunggalar Kab. Ngawi,5,1,0,0,0,6
Kec. Widodaren Kab. Ngawi,2,0,0,0,0,2
Kec. Poncol Kab. Magetan,1,1,0,0,0,2
Kec. Parang Kab. Magetan,2,0,0,0,0,2
Kec. Kawedanan Kab. Magetan,2,0,0,0,0,2
Kec. Magetan Kab. Magetan,9,1,0,0,0,10
Kec. Plaosan Kab. Magetan,2,0,0,0,0,2
Kec. Sukomoro Kab. Magetan,2,0,0,0,0,2
Kec. Maospati Kab. Magetan,2,2,0,0,0,4
Kec. Barat Kab. Magetan,4,0,0,0,0,4
Kec. Karas Kab. Magetan,1,0,0,0,0,1
Kec. Sidorejo Kab. Magetan,1,1,0,0,0,2
Kec. Purwodadi Kab. Pasuruan,6,0,0,0,0,6
Kec. Tutur Kab. Pasuruan,1,1,0,0,0,2
Kec. Tosari Kab. Pasuruan,3,1,0,0,0,4
Kec. Lumbang Kab. Pasuruan,1,1,0,0,0,2
Kec. Kejayan Kab. Pasuruan,2,0,0,0,0,2
Kec. Wonorejo Kab. Pasuruan,2,0,0,0,0,2
Kec. Purwosari Kab. Pasuruan,0,6,0,0,0,6
Kec. Prigen Kab. Pasuruan,4,2,0,0,0,6
Kec. Sukorejo Kab. Pasuruan,1,1,0,0,0,2
Kec. Pandaan Kab. Pasuruan,6,4,0,0,0,10
Kec. Gempol Kab. Pasuruan,1,1,0,0,0,2
Kec. Beji Kab. Pasuruan,0,2,0,0,0,2
Kec. Bangil Kab. Pasuruan,5,1,0,0,0,6
Kec. Kraton Kab. Pasuruan,4,0,0,0,0,4
Kec. Pohjentrek Kab. Pasuruan,3,1,0,0,0,4
Kec. Gondang Wetan Kab. Pasuruan,1,1,0,0,0,2
Kec. Grati Kab. Pasuruan,0,0,0,0,0,0
Kec. Lekok Kab. Pasuruan,2,0,0,0,0,2
Kec. Nguling Kab. Pasuruan,2,0,0,0,0,2
Kec. Karang Pilang Kota Surabaya,5,1,0,0,0,6
Kec. Jambangan Kota Surabaya,4,2,0,0,0,6
Kec. Gayungan Kota Surabaya,11,1,0,0,0,12
Kec. Wonocolo Kota Surabaya,33,1,0,0,0,34
Kec. Tenggilis Mejoyo Kota Surabaya,2,2,0,0,0,4
Kec. Rungkut Kota Surabaya,8,4,0,0,0,12
Kec. Sukolilo Kota Surabaya,25,5,0,0,0,30
Kec. Mulyorejo Kota Surabaya,22,0,0,0,0,22
Kec. Gubeng Kota Surabaya,18,0,0,0,0,18
Kec. Wonokromo Kota Surabaya,12,2,0,0,0,14
Kec. Dukuh Pakis Kota Surabaya,14,0,0,0,0,14
Kec. Wiyung Kota Surabaya,7,3,0,0,0,10
Kec. Lakarsantri Kota Surabaya,11,1,0,0,0,12
Kec. Tandes Kota Surabaya,7,1,0,0,0,8
Kec. Sukomanunggal Kota Surabaya,13,1,0,0,0,14
Kec. Sawahan Kota Surabaya,12,4,0,0,0,16
Kec. Tegal Sari Kota Surabaya,10,0,0,0,0,10
Kec. Genteng Kota Surabaya,17,5,0,0,0,22
Kec. Tambaksari Kota Surabaya,15,1,0,0,0,16
Kec. Kenjeran Kota Surabaya,5,1,0,0,0,6
Kec. Simokerto Kota Surabaya,7,1,0,0,0,8
Kec. Semampir Kota Surabaya,15,0,0,0,0,15
Kec. Pabean Cantian Kota Surabaya,5,1,0,0,0,6
Kec. Bubutan Kota Surabaya,2,0,0,0,0,2
Kec. Krembangan Kota Surabaya,13,3,0,0,0,16
Kec. Asemrowo Kota Surabaya,2,0,0,0,0,2
Kec. Benowo Kota Surabaya,6,0,0,0,0,6
Kec. Bulak Kota Surabaya,2,2,0,0,0,4
Kec. Pakal Kota Surabaya,3,3,0,0,0,6
Kec. Sambi Kerep Kota Surabaya,16,0,0,0,0,16
Kec. Wringin Anom Kab. Gresik,2,0,0,0,0,2
Kec. Driyorejo Kab. Gresik,6,2,0,0,0,8
Kec. Kedamean Kab. Gresik,2,2,0,0,0,4
Kec. Menganti Kab. Gresik,4,2,0,0,0,6
Kec. Cerme Kab. Gresik,5,1,0,0,0,6
Kec. Benjeng Kab. Gresik,3,1,0,0,0,4
Kec. Balong Panggang Kab. Gresik,1,1,0,0,0,2
Kec. Duduk Sampeyan Kab. Gresik,0,0,0,0,0,0
Kec. Kebomas Kab. Gresik,2,2,0,0,0,4
Kec. Gresik Kab. Gresik,9,3,0,0,0,12
Kec. Manyar Kab. Gresik,2,2,0,0,0,4
Kec. Bungah Kab. Gresik,1,3,0,0,0,4
Kec. Sidayu Kab. Gresik,4,2,0,0,0,6
Kec. Dukun Kab. Gresik,1,1,0,0,0,2
Kec. Panceng Kab. Gresik,2,0,0,0,0,2
Kec. Ujung Pangkah Kab. Gresik,4,4,0,0,0,8
Kec. Sangkapura Kab. Gresik,1,3,0,0,0,4
Kec. Tambak Kab. Gresik,2,0,0,0,0,2
Kec. Sukorame Kab. Lamongan,0,0,0,0,0,0
Kec. Bluluk Kab. Lamongan,2,0,0,0,0,2
Kec. Ngimbang Kab. Lamongan,4,2,0,0,0,6
Kec. Sambeng Kab. Lamongan,0,0,0,0,0,0
Kec. Mantup Kab. Lamongan,2,0,0,0,0,2
Kec. Kembang Bahu Kab. Lamongan,1,1,0,0,0,2
Kec. Sugio Kab. Lamongan,0,2,0,0,0,2
Kec. Kedungpring Kab. Lamongan,6,0,0,0,0,6
Kec. Modo Kab. Lamongan,1,1,0,0,0,2
Kec. Babat Kab. Lamongan,7,3,0,0,0,10
Kec. Pucuk Kab. Lamongan,0,2,0,0,0,2
Kec. Sukodadi Kab. Lamongan,1,3,0,0,0,4
Kec. Lamongan Kab. Lamongan,10,2,0,0,0,12
Kec. Deket Kab. Lamongan,0,0,0,0,0,0
Kec. Glagah Kab. Lamongan,1,1,0,0,0,2
Kec. Karangbinangun Kab. Lamongan,0,2,0,0,0,2
Kec. Kalitengah Kab. Lamongan,0,0,0,0,0,0
Kec. Karang Geneng Kab. Lamongan,2,0,0,0,0,2
Kec. Sekaran Kab. Lamongan,4,2,0,0,0,6
Kec. Maduran Kab. Lamongan,2,2,0,0,0,4
Kec. Laren Kab. Lamongan,1,1,0,0,0,2
Kec. Solokuro Kab. Lamongan,6,2,0,0,0,8
Kec. Paciran Kab. Lamongan,5,5,0,0,0,10
Kec. Brondong Kab. Lamongan,5,3,0,0,0,8
Kec. Sarirejo Kab. Lamongan,1,1,0,0,0,2
Kec. Wonotirto Kab. Blitar,1,1,0,0,0,2
Kec. Wates Kab. Blitar,2,0,0,0,0,2
Kec. Sutojayan Kab. Blitar,2,0,0,0,0,2
Kec. Kademangan Kab. Blitar,0,2,0,0,0,2
Kec. Talun Kab. Blitar,2,2,0,0,0,4
Kec. Kesamben Kab. Blitar,6,4,0,0,0,10
Kec. Wlingi Kab. Blitar,2,0,0,0,0,2
Kec. Garum Kab. Blitar,4,2,0,0,0,6
Kec. Sanankulon Kab. Blitar,3,1,0,0,0,4
Kec. Ponggok Kab. Blitar,2,2,0,0,0,4
Kec. Srengat Kab. Blitar,6,0,0,0,0,6
Kec. Wonodadi Kab. Blitar,0,0,0,0,0,0
Kec. Besuki Kab. Tulungagung,2,0,0,0,0,2
Kec. Bandung Kab. Tulungagung,1,1,0,0,0,2
Kec. Pakel Kab. Tulungagung,4,0,0,0,0,4
Kec. Campur Darat Kab. Tulungagung,1,1,0,0,0,2
Kec. Kalidawir Kab. Tulungagung,5,1,0,0,0,6
Kec. Rejotangan Kab. Tulungagung,6,2,0,0,0,8
Kec. Ngunut Kab. Tulungagung,5,1,0,0,0,6
Kec. Boyolangu Kab. Tulungagung,2,0,0,0,0,2
Kec. Tulungagung Kab. Tulungagung,5,1,0,0,0,6
Kec. Kedungwaru Kab. Tulungagung,3,1,0,0,0,4
Kec. Karangrejo Kab. Tulungagung,3,1,0,0,0,4
Kec. Kauman Kab. Tulungagung,2,0,0,0,0,2
Kec. Gondang Kab. Tulungagung,2,0,0,0,0,2
Kec. Sendang Kab. Tulungagung,0,0,0,0,0,0
Kec. Tlanakan Kab. Pamekasan,2,4,0,0,0,6
Kec. Pademawu Kab. Pamekasan,5,3,0,0,0,8
Kec. Galis Kab. Pamekasan,1,1,0,0,0,2
Kec. Larangan Kab. Pamekasan,1,3,0,0,0,4
Kec. Pamekasan Kab. Pamekasan,18,2,0,0,0,20
Kec. Proppo Kab. Pamekasan,1,1,0,0,0,2
Kec. Palengaan Kab. Pamekasan,4,8,0,0,0,12
Kec. Pegantenan Kab. Pamekasan,1,1,0,0,0,2
Kec. Kadur Kab. Pamekasan,3,9,0,0,0,12
Kec. Pakong Kab. Pamekasan,7,1,0,0,0,8
Kec. Waru Kab. Pamekasan,1,1,0,0,0,2
Kec. Batu Marmar Kab. Pamekasan,0,0,0,0,0,0
Kec. Pasean Kab. Pamekasan,2,0,0,0,0,2
Kec. Sreseh Kab. Sampang,6,0,0,0,0,6
Kec. Torjun Kab. Sampang,2,0,0,0,0,2
Kec. Sampang Kab. Sampang,7,3,0,0,0,10
Kec. Camplong Kab. Sampang,4,0,0,0,0,4
Kec. Omben Kab. Sampang,2,0,0,0,0,2
Kec. Kedungdung Kab. Sampang,4,2,0,0,0,6
Kec. Tambelangan Kab. Sampang,1,1,0,0,0,2
Kec. Banyuates Kab. Sampang,3,1,0,0,0,4
Kec. Robatal Kab. Sampang,5,1,0,0,0,6
Kec. Ketapang Kab. Sampang,4,2,0,0,0,6
Kec. Sokobanah Kab. Sampang,4,2,0,0,0,6
Kec. Karangpenang Kab. Sampang,2,2,0,0,0,4
Kec. Pangarengan Kab. Sampang,4,0,0,0,0,4
Kec. Tarik Kab. Sidoarjo,2,0,0,0,0,2
Kec. Prambon Kab. Sidoarjo,2,0,0,0,0,2
Kec. Krembung Kab. Sidoarjo,0,2,0,0,0,2
Kec. Porong Kab. Sidoarjo,9,1,0,0,0,10
Kec. Jabon Kab. Sidoarjo,1,1,0,0,0,2
Kec. Tanggulangin Kab. Sidoarjo,3,1,0,0,0,4
Kec. Candi Kab. Sidoarjo,2,0,0,0,0,2
Kec. Tulangan Kab. Sidoarjo,2,2,0,0,0,4
Kec. Wonoayu Kab. Sidoarjo,10,0,0,0,0,10
Kec. Sukodono Kab. Sidoarjo,1,1,0,0,0,2
Kec. Sidoarjo Kab. Sidoarjo,27,5,0,0,0,32
Kec. Buduran Kab. Sidoarjo,4,0,0,0,0,4
Kec. Sedati Kab. Sidoarjo,5,1,0,0,0,6
Kec. Waru Kab. Sidoarjo,7,1,0,0,0,8
Kec. Gedangan Kab. Sidoarjo,6,2,0,0,0,8
Kec. Taman Kab. Sidoarjo,9,3,0,0,0,12
Kec. Krian Kab. Sidoarjo,15,1,0,0,0,16
Kec. Balong Bendo Kab. Sidoarjo,3,1,0,0,0,4
Kec. Geger Kab. Madiun,1,1,0,0,0,2
Kec. Dolopo Kab. Madiun,1,1,0,0,0,2
Kec. Dagangan Kab. Madiun,4,2,0,0,0,6
Kec. Wungu Kab. Madiun,1,1,0,0,0,2
Kec. Saradan Kab. Madiun,1,1,0,0,0,2
Kec. Pilangkenceng Kab. Madiun,2,0,0,0,0,2
Kec. Mejayan Kab. Madiun,5,1,0,0,0,6
Kec. Madiun Kab. Madiun,3,1,0,0,0,4
Kec. Jiwan Kab. Madiun,4,2,0,0,0,6
Kec. Sawang Kab. Aceh Utara,0,0,0,0,0,0
Kec. Nisam Kab. Aceh Utara,2,0,0,0,0,2
Kec. Kuta Makmur Kab. Aceh Utara,2,0,0,0,0,2
Kec. Syamtalira Bayu Kab. Aceh Utara,0,1,0,0,0,1
Kec. Meurah Mulia Kab. Aceh Utara,1,1,0,0,0,2
Kec. Matangkuli Kab. Aceh Utara,4,2,0,0,0,6
Kec. Cot Girek Kab. Aceh Utara,0,0,0,0,0,0
Kec. Tanah Jambo Aye Kab. Aceh Utara,5,3,0,0,0,8
Kec. Seunuddon Kab. Aceh Utara,6,2,0,0,0,8
Kec. Baktiya Kab. Aceh Utara,4,0,0,0,0,4
Kec. Tanah Luas Kab. Aceh Utara,4,0,0,0,0,4
Kec. Samudera Kab. Aceh Utara,0,0,0,0,0,0
Kec. Syamtalira Aron Kab. Aceh Utara,1,1,0,0,0,2
Kec. Tanah Pasir Kab. Aceh Utara,2,2,0,0,0,4
Kec. Langkahan Kab. Aceh Utara,0,0,0,0,0,0
Kec. Baktiya Barat Kab. Aceh Utara,0,0,0,0,0,0
Kec. Simpang Keramat Kab. Aceh Utara,0,0,0,0,0,0
Kec. Nibong Kab. Aceh Utara,2,0,0,0,0,2
Kec. Paya Bakong Kab. Aceh Utara,1,1,0,0,0,2
Kec. Muara Batu Kab. Aceh Utara,0,2,0,0,0,2
Kec. Dewantara Kab. Aceh Utara,10,0,0,0,0,10
Kec. Lhoksukon Kab. Aceh Utara,8,4,0,0,0,12
Kec. Pirak Timu Kab. Aceh Utara,0,2,0,0,0,2
Kec. Geureudong Pase Kab. Aceh Utara,2,0,0,0,0,2
Kec. Banda Baro Kab. Aceh Utara,0,0,0,0,0,0
Kec. Nisam Antara Kab. Aceh Utara,1,1,0,0,0,2
Kec. Trumon Kab. Aceh Selatan,0,0,0,0,0,0
Kec. Bakongan Kab. Aceh Selatan,20,2,0,0,0,22
Kec. Kluet Selatan Kab. Aceh Selatan,1,1,0,0,0,2
Kec. Kluet Utara Kab. Aceh Selatan,2,0,0,0,0,2
Kec. Tapak Tuan Kab. Aceh Selatan,1,3,0,0,0,4
Kec. Samadua Kab. Aceh Selatan,2,0,0,0,0,2
Kec. Sawang Kab. Aceh Selatan,0,0,0,0,0,0
Kec. Meukek Kab. Aceh Selatan,0,2,0,0,0,2
Kec. Labuhan Haji Kab. Aceh Selatan,3,1,0,0,0,4
Kec. Pasie Raja Kab. Aceh Selatan,0,0,0,0,0,0
Kec. Trumon Timur Kab. Aceh Selatan,1,1,0,0,0,2
Kec. Kluet Timur Kab. Aceh Selatan,0,0,0,0,0,0
Kec. Bakongan Timur Kab. Aceh Selatan,0,0,0,0,0,0
Kec. Kluet Tengah Kab. Aceh Selatan,0,0,0,0,0,0
Kec. Labuhan Haji Barat Kab. Aceh Selatan,2,0,0,0,0,2
Kec. Labuhan Haji Timur Kab. Aceh Selatan,0,0,0,0,0,0
Kec. Kota Bahagia Kab. Aceh Selatan,1,1,0,0,0,2
Kec. Trumon Tengah Kab. Aceh Selatan,0,0,0,0,0,0
Kec. Lawe Alas Kab. Aceh Tenggara,0,0,0,0,0,0
Kec. Lawe Sigala-Gala Kab. Aceh Tenggara,0,2,0,0,0,2
Kec. Babussalam Kab. Aceh Tenggara,3,3,0,0,0,6
Kec. Badar Kab. Aceh Tenggara,0,0,0,0,0,0
Kec. Darul Hasanah Kab. Aceh Tenggara,0,0,0,0,0,0
Kec. Babul Makmur Kab. Aceh Tenggara,1,3,0,0,0,4
Kec. Lawe Bulan Kab. Aceh Tenggara,0,0,0,0,0,0
Kec. Bukit Tusam Kab. Aceh Tenggara,0,0,0,0,0,0
Kec. Semadam Kab. Aceh Tenggara,0,0,0,0,0,0
Kec. Babul Rahmat Kab. Aceh Tenggara,0,0,0,0,0,0
Kec. Ketambe Kab. Aceh Tenggara,0,0,0,0,0,0
Kec. Lawe Sumur Kab. Aceh Tenggara,0,0,0,0,0,0
Kec. Tanoh Alas Kab. Aceh Tenggara,0,0,0,0,0,0
Kec. Lueser Kab. Aceh Tenggara,0,0,0,0,0,0
Kec. Simpang Kiri Kota Subulussalam,5,5,0,0,0,10
Kec. Penanggalan Kota Subulussalam,0,0,0,0,0,0
Kec. Rundeng Kota Subulussalam,0,0,0,0,0,0
Kec. Sultan Daulat Kota Subulussalam,2,0,0,0,0,2
Kec. Longkib Kota Subulussalam,0,0,0,0,0,0
Kec. Lhoong Kab. Aceh Besar,0,0,0,0,0,0
Kec. Lhoknga Kab. Aceh Besar,1,1,0,0,0,2
Kec. Indrapuri Kab. Aceh Besar,4,2,0,0,0,6
Kec. Seulimeum Kab. Aceh Besar,3,1,0,0,0,4
Kec. Mesjid Raya Kab. Aceh Besar,0,0,0,0,0,0
Kec. Darussalam Kab. Aceh Besar,1,1,0,0,0,2
Kec. Kuta Baro Kab. Aceh Besar,5,0,0,0,0,5
Kec. Montasik Kab. Aceh Besar,2,2,0,0,0,4
Kec. Ingin Jaya Kab. Aceh Besar,11,1,0,0,0,12
Kec. Suka Makmur Kab. Aceh Besar,2,0,0,0,0,2
Kec. Darul Imarah Kab. Aceh Besar,9,1,0,0,0,10
Kec. Peukan Bada Kab. Aceh Besar,4,0,0,0,0,4
Kec. Pulo Aceh Kab. Aceh Besar,2,0,0,0,0,2
Kec. Leupung Kab. Aceh Besar,0,0,0,0,0,0
Kec. Kuta Malaka Kab. Aceh Besar,4,0,0,0,0,4
Kec. Lembah Seulawah Kab. Aceh Besar,2,0,0,0,0,2
Kec. Kota Jantho Kab. Aceh Besar,0,2,0,0,0,2
Kec. Baitussalam Kab. Aceh Besar,0,2,0,0,0,2
Kec. Krung Barona Jaya Kab. Aceh Besar,1,1,0,0,0,2
Kec. Simpang Tiga Kab. Aceh Besar,4,0,0,0,0,4
Kec. Kuta Cot Glie Kab. Aceh Besar,0,2,0,0,0,2
Kec. Blang Bintang Kab. Aceh Besar,6,0,0,0,0,6
Kec. Birem Bayeun Kab. Aceh Timur,2,0,0,0,0,2
Kec. Rantau Selamat Kab. Aceh Timur,1,1,0,0,0,2
Kec. Peureulak Kab. Aceh Timur,4,0,0,0,0,4
Kec. Ranto Peureulak Kab. Aceh Timur,0,2,0,0,0,2
Kec. Idi Rayeuk Kab. Aceh Timur,1,1,0,0,0,2
Kec. Darul Aman Kab. Aceh Timur,2,0,0,0,0,2
Kec. Nurussalam Kab. Aceh Timur,0,0,0,0,0,0
Kec. Julok Kab. Aceh Timur,0,0,0,0,0,0
Kec. Pante Beudari Kab. Aceh Timur,0,2,0,0,0,2
Kec. Simpang Ulim Kab. Aceh Timur,1,1,0,0,0,2
Kec. Sungai Raya Kab. Aceh Timur,2,0,0,0,0,2
Kec. Peureulak Barat Kab. Aceh Timur,0,0,0,0,0,0
Kec. Banda Alam Kab. Aceh Timur,2,0,0,0,0,2
Kec. Idi Tunong Kab. Aceh Timur,2,0,0,0,0,2
Kec. Peudawa Kab. Aceh Timur,0,0,0,0,0,0
Kec. Indra Makmur Kab. Aceh Timur,0,0,0,0,0,0
Kec. Madat Kab. Aceh Timur,0,0,0,0,0,0
Kec. Darul Ihsan Kab. Aceh Timur,2,0,0,0,0,2
Kec. Peunaron Kab. Aceh Timur,1,1,0,0,0,2
Kec. Darul Falah Kab. Aceh Timur,0,0,0,0,0,0
Kec. Samalanga Kab. Bireuen,2,2,0,0,0,4
Kec. Pandrah Kab. Bireuen,0,0,0,0,0,0
Kec. Jeunib Kab. Bireuen,0,1,0,0,0,1
Kec. Peudada Kab. Bireuen,0,0,0,0,0,0
Kec. Juli Kab. Bireuen,0,0,0,0,0,0
Kec. Jeumpa Kab. Bireuen,4,0,0,0,0,4
Kec. Jangka Kab. Bireuen,0,0,0,0,0,0
Kec. Peusangan Kab. Bireuen,3,1,0,0,0,4
Kec. Makmur Kab. Bireuen,0,0,0,0,0,0
Kec. Ganda Pura Kab. Bireuen,2,0,0,0,0,2
Kec. Simpang Mamplam Kab. Bireuen,2,0,0,0,0,2
Kec. Peulimbang Kab. Bireuen,0,0,0,0,0,0
Kec. Kota Juang Kab. Bireuen,2,2,0,0,0,4
Kec. Kuala Kab. Bireuen,0,0,0,0,0,0
Kec. Peusangan Selatan Kab. Bireuen,0,0,0,0,0,0
Kec. Peusangan Siblah Krueng Kab. Bireuen,0,0,0,0,0,0
Kec. Kuta Blang Kab. Bireuen,0,0,0,0,0,0
Kec. Geumpang Kab. Pidie,0,0,0,0,0,0
Kec. Glumpang Tiga Kab. Pidie,3,1,0,0,0,4
Kec. Mutiara Kab. Pidie,0,0,0,0,0,0
Kec. Tangse Kab. Pidie,0,0,0,0,0,0
Kec. Sakti Kab. Pidie,2,0,0,0,0,2
Kec. Mila Kab. Pidie,0,0,0,0,0,0
Kec. Padang Tiji Kab. Pidie,1,1,0,0,0,2
Kec. Delima Kab. Pidie,4,0,0,0,0,4
Kec. Indrajaya Kab. Pidie,3,1,0,0,0,4
Kec. Peukan Baro Kab. Pidie,2,0,0,0,0,2
Kec. Kembang Tanjung Kab. Pidie,0,0,0,0,0,0
Kec. Simpang Tiga Kab. Pidie,0,0,0,0,0,0
Kec. Kota Sigli Kab. Pidie,3,1,0,0,0,4
Kec. Pidie Kab. Pidie,7,1,0,0,0,8
Kec. Muara Tiga Kab. Pidie,0,0,0,0,0,0
Kec. Grong-Grong Kab. Pidie,1,1,0,0,0,2
Kec. Mutiara Timur Kab. Pidie,2,0,0,0,0,2
Kec. Glumpang Baro Kab. Pidie,0,0,0,0,0,0
Kec. Keumala Kab. Pidie,4,0,0,0,0,4
Kec. Linge Kab. Aceh Tengah,0,0,0,0,0,0
Kec. Bintang Kab. Aceh Tengah,0,0,0,0,0,0
Kec. Pegasing Kab. Aceh Tengah,0,0,0,0,0,0
Kec. Bebesen Kab. Aceh Tengah,0,0,0,0,0,0
Kec. Silih Nara Kab. Aceh Tengah,0,0,0,0,0,0
Kec. Kute Panang Kab. Aceh Tengah,0,0,0,0,0,0
Kec. Ketol Kab. Aceh Tengah,0,0,0,0,0,0
Kec. Celala Kab. Aceh Tengah,0,0,0,0,0,0
Kec. Kebayakan Kab. Aceh Tengah,2,2,0,0,0,4
Kec. Laut Tawar Kab. Aceh Tengah,0,0,0,0,0,0
Kec. Atu Lintang Kab. Aceh Tengah,0,2,0,0,0,2
Kec. Jagong Jeget Kab. Aceh Tengah,0,0,0,0,0,0
Kec. Bies Kab. Aceh Tengah,0,0,0,0,0,0
Kec. Rusip Antara Kab. Aceh Tengah,0,0,0,0,0,0
Kec. Timang Gajah Kab. Bener Meriah,1,1,0,0,0,2
Kec. Bukit Kab. Bener Meriah,6,0,0,0,0,6
Kec. Bandar Kab. Bener Meriah,5,1,0,0,0,6
Kec. Permata Kab. Bener Meriah,2,0,0,0,0,2
Kec. Pintu Rime Gayo Kab. Bener Meriah,0,0,0,0,0,0
Kec. Wih Pesam Kab. Bener Meriah,2,0,0,0,0,2
Kec. Syiah Utama Kab. Bener Meriah,0,0,0,0,0,0
Kec. Bener Kelipah Kab. Bener Meriah,0,0,0,0,0,0
Kec. Mesidah Kab. Bener Meriah,0,0,0,0,0,0
Kec. Gajah Putih Kab. Bener Meriah,2,0,0,0,0,2
Kec. Teunom Kab. Aceh Jaya,0,0,0,0,0,0
Kec. Krueng Sabee Kab. Aceh Jaya,2,2,0,0,0,4
Kec. Setia Bakti Kab. Aceh Jaya,0,2,0,0,0,2
Kec. Sampoiniet Kab. Aceh Jaya,1,1,0,0,0,2
Kec. Jaya Kab. Aceh Jaya,2,0,0,0,0,2
Kec. Panga Kab. Aceh Jaya,2,0,0,0,0,2
Kec. Indra Jaya Kab. Aceh Jaya,0,0,0,0,0,0
Kec. Darul Hikmah Kab. Aceh Jaya,0,0,0,0,0,0
Kec. Pasie Raya Kab. Aceh Jaya,0,0,0,0,0,0
Kec. Manggeng Kab. Aceh Barat Daya,1,1,0,0,0,2
Kec. Tangan-Tangan Kab. Aceh Barat Daya,0,0,0,0,0,0
Kec. Blangpidie Kab. Aceh Barat Daya,1,1,0,0,0,2
Kec. Susoh Kab. Aceh Barat Daya,4,0,0,0,0,4
Kec. Kuala Batee Kab. Aceh Barat Daya,2,0,0,0,0,2
Kec. Babahrot Kab. Aceh Barat Daya,0,0,0,0,0,0
Kec. Lembah Sabil Kab. Aceh Barat Daya,2,0,0,0,0,2
Kec. Setia Kab. Aceh Barat Daya,0,0,0,0,0,0
Kec. Jeumpa Kab. Aceh Barat Daya,0,0,0,0,0,0
Kec. Blangkejeren Kab. Gayo Lues,2,0,0,0,0,2
Kec. Kutapanjang Kab. Gayo Lues,2,0,0,0,0,2
Kec. Rikit Gaib Kab. Gayo Lues,0,0,0,0,0,0
Kec. Terangun Kab. Gayo Lues,0,0,0,0,0,0
Kec. Pining Kab. Gayo Lues,0,0,0,0,0,0
Kec. Blangjerango Kab. Gayo Lues,0,0,0,0,0,0
Kec. Putri Betung Kab. Gayo Lues,0,0,0,0,0,0
Kec. Blang Pegayon Kab. Gayo Lues,1,1,0,0,0,2
Kec. Pantan Cuaca Kab. Gayo Lues,0,0,0,0,0,0
Kec. Tripe Jaya Kab. Gayo Lues,0,0,0,0,0,0
Kec. Pulau Banyak Kab. Aceh Singkil,0,0,0,0,0,0
Kec. Singkil Kab. Aceh Singkil,0,0,0,0,0,0
Kec. Simpang Kanan Kab. Aceh Singkil,0,0,0,0,0,0
Kec. Singkil Utara Kab. Aceh Singkil,0,2,0,0,0,2
Kec. Gunung Mariah Kab. Aceh Singkil,0,0,0,0,0,0
Kec. Danau Paris Kab. Aceh Singkil,2,0,0,0,0,2
Kec. Suro Makmur Kab. Aceh Singkil,0,0,0,0,0,0
Kec. Kuta Baharu Kab. Aceh Singkil,0,0,0,0,0,0
Kec. Singkohor Kab. Aceh Singkil,0,0,0,0,0,0
Kec. Pulau Banyak Barat Kab. Aceh Singkil,0,0,0,0,0,0
Kec. Tamiang Hulu Kab. Aceh Tamiang,1,1,0,0,0,2
Kec. Kejuruan Muda Kab. Aceh Tamiang,4,0,0,0,0,4
Kec. Kualasimpang Kab. Aceh Tamiang,1,1,0,0,0,2
Kec. Seruway Kab. Aceh Tamiang,3,1,0,0,0,4
Kec. Bendahara Kab. Aceh Tamiang,0,2,0,0,0,2
Kec. Karang Baru Kab. Aceh Tamiang,6,0,0,0,0,6
Kec. Manyak Payed Kab. Aceh Tamiang,2,2,0,0,0,4
Kec. Rantau Kab. Aceh Tamiang,10,0,0,0,0,10
Kec. Banda Mulya Kab. Aceh Tamiang,0,0,0,0,0,0
Kec. Bandar Pusaka Kab. Aceh Tamiang,0,0,0,0,0,0
Kec. Tenggulun Kab. Aceh Tamiang,0,0,0,0,0,0
Kec. Sekerak Kab. Aceh Tamiang,0,0,0,0,0,0
Kec. Darul Makmur Kab. Nagan Raya,7,3,0,0,0,10
Kec. Kuala Kab. Nagan Raya,3,1,0,0,0,4
Kec. Beutong Kab. Nagan Raya,4,0,0,0,0,4
Kec. Seunagan Kab. Nagan Raya,1,4,0,0,0,5
Kec. Seunagan Timur Kab. Nagan Raya,0,0,0,0,0,0
Kec. Kuala Pesisir Kab. Nagan Raya,1,1,0,0,0,2
Kec. Tadu Raya Kab. Nagan Raya,0,0,0,0,0,0
Kec. Suka Makmue Kab. Nagan Raya,0,0,0,0,0,0
Kec. Tripa Makmur Kab. Nagan Raya,0,0,0,0,0,0
Kec. Teupah Selatan Kab. Simeulue,1,1,0,0,0,2
Kec. Simeulue Timur Kab. Simeulue,2,2,0,0,0,4
Kec. Simeulue Tengah Kab. Simeulue,2,0,0,0,0,2
Kec. Salang Kab. Simeulue,0,0,0,0,0,0
Kec. Simeulue Barat Kab. Simeulue,0,0,0,0,0,0
Kec. Teupah Barat Kab. Simeulue,0,0,0,0,0,0
Kec. Teluk Dalam Kab. Simeulue,1,1,0,0,0,2
Kec. Alafan Kab. Simeulue,2,0,0,0,0,2
