Kec. 2 x 11 Kayu Tanam Kab. Padang Pariaman,6,0,0,0,0,6
Kec. VI Lingkung Kab. Padang Pariaman,4,0,0,0,0,4
Kec. Lunang Kab. Pesisir Selatan,0,0,0,0,0,0
Kec. Basa Ampek Balai Tapan Kab. Pesisir Selatan,1,1,0,0,0,2
Kec. Pancung Soal Kab. Pesisir Selatan,1,1,0,0,0,2
Kec. Linggo Saribaganti Kab. Pesisir Selatan,2,0,0,0,0,2
Kec. Ranah Pesisir Kab. Pesisir Selatan,2,2,0,0,0,4
Kec. Lengayang Kab. Pesisir Selatan,0,2,0,0,0,2
Kec. Sutera Kab. Pesisir Selatan,2,1,0,0,0,3
Kec. Batang Kapas Kab. Pesisir Selatan,1,1,0,0,0,2
Kec. IV Jurai Kab. Pesisir Selatan,5,1,0,0,0,6
Kec. Bayang Kab. Pesisir Selatan,0,2,0,0,0,2
Kec. Koto XI Terusan Kab. Pesisir Selatan,0,0,0,0,0,0
Kec. Bayang Utara Kab. Pesisir Selatan,2,0,0,0,0,2
Kec. Silaut Kab. Pesisir Selatan,2,0,0,0,0,2
Kec. Air Pura Kab. Pesisir Selatan,0,0,0,0,0,0
Kec. X Koto Kab. Tanah Datar,5,1,0,0,0,6
Kec. Batipuh Kab. Tanah Datar,2,0,0,0,0,2
Kec. Pariangan Kab. Tanah Datar,4,0,0,0,0,4
Kec. Rambatan Kab. Tanah Datar,0,2,0,0,0,2
Kec. Lima Kaum Kab. Tanah Datar,3,3,0,0,0,6
Kec. Tanjung Emas Kab. Tanah Datar,2,0,0,0,0,2
Kec. Padang Ganting Kab. Tanah Datar,2,0,0,0,0,2
Kec. Lintau Buo Kab. Tanah Datar,0,0,0,0,0,0
Kec. Sungayang Kab. Tanah Datar,2,0,0,0,0,2
Kec. Sungai Tarab Kab. Tanah Datar,2,0,0,0,0,2
Kec. Salimpaung Kab. Tanah Datar,2,0,0,0,0,2
Kec. Lintau Buo Utara Kab. Tanah Datar,0,2,0,0,0,2
Kec. Tanjung Mutiara Kab. Agam,2,0,0,0,0,2
Kec. Lubuk Basung Kab. Agam,5,3,0,0,0,8
Kec. Tanjung Raya Kab. Agam,5,1,0,0,0,6
Kec. Matur Kab. Agam,1,1,0,0,0,2
Kec. IV Koto Kab. Agam,5,1,0,0,0,6
Kec. Baso Kab. Agam,1,1,0,0,0,2
Kec. Tilatang Kamang Kab. Agam,2,2,0,0,0,4
Kec. Palembayan Kab. Agam,2,0,0,0,0,2
Kec. Palupuh Kab. Agam,0,0,0,0,0,0
Kec. Sungai Pua Kab. Agam,1,1,0,0,0,2
Kec. Candung Kab. Agam,1,1,0,0,0,2
Kec. Kamang Magek Kab. Agam,2,0,0,0,0,2
Kec. Banuhampu Kab. Agam,4,0,0,0,0,4
Kec. Ampek Angkek Kab. Agam,3,1,0,0,0,4
Kec. Ampek Nagari Kab. Agam,2,0,0,0,0,2
Kec. Langgam Kab. Pelalawan,2,0,0,0,0,2
Kec. Pangkalan Kuras Kab. Pelalawan,2,0,0,0,0,2
Kec. Bunut Kab. Pelalawan,6,0,0,0,0,6
Kec. Kuala Kampar Kab. Pelalawan,1,1,0,0,0,2
Kec. Pangkalan Kerinci Kab. Pelalawan,11,1,0,0,0,12
Kec. Ukui Kab. Pelalawan,0,0,0,0,0,0
Kec. Pangkalan Lesung Kab. Pelalawan,2,0,0,0,0,2
Kec. Kerumutan Kab. Pelalawan,0,0,0,0,0,0
Kec. Pelalawan Kab. Pelalawan,0,0,0,0,0,0
Kec. Teluk Meranti Kab. Pelalawan,1,1,0,0,0,2
Kec. Bandar Sei Kijang Kab. Pelalawan,6,0,0,0,0,6
Kec. Bandar Petalangan Kab. Pelalawan,0,0,0,0,0,0
Kec. Ujung Batu Kab. Rokan Hulu,2,2,0,0,0,4
Kec. Rokan IV Koto Kab. Rokan Hulu,0,2,0,0,0,2
Kec. Rambah Kab. Rokan Hulu,3,1,0,0,0,4
Kec. Tambusai Kab. Rokan Hulu,6,0,0,0,0,6
Kec. Kepenuhan Kab. Rokan Hulu,0,2,0,0,0,2
Kec. Kunto Darussalam Kab. Rokan Hulu,4,2,0,0,0,6
Kec. Rambah Samo Kab. Rokan Hulu,2,0,0,0,0,2
Kec. Rambah Hilir Kab. Rokan Hulu,5,1,0,0,0,6
Kec. Tambusai Utara Kab. Rokan Hulu,4,2,0,0,0,6
Kec. Bangun Purba Kab. Rokan Hulu,2,0,0,0,0,2
Kec. Tandun Kab. Rokan Hulu,6,0,0,0,0,6
Kec. Kabun Kab. Rokan Hulu,0,0,0,0,0,0
Kec. Bonai Darussalam Kab. Rokan Hulu,0,0,0,0,0,0
Kec. Pagaran Tapah Darussalam Kab. Rokan Hulu,2,0,0,0,0,2
Kec. Pendalian IV Koto Kab. Rokan Hulu,1,1,0,0,0,2
Kec. Kepenuhan Hulu Kab. Rokan Hulu,0,0,0,0,0,0
Kec. Kuantan Mudik Kab. Kuantan Singingi,4,0,0,0,0,4
Kec. Kuantan Tengah Kab. Kuantan Singingi,5,3,0,0,0,8
Kec. Benai Kab. Kuantan Singingi,3,1,0,0,0,4
Kec. Singingi Kab. Kuantan Singingi,4,0,0,0,0,4
Kec. Kuantan Hilir Kab. Kuantan Singingi,1,1,0,0,0,2
Kec. Cerenti Kab. Kuantan Singingi,0,0,0,0,0,0
Kec. Pangean Kab. Kuantan Singingi,2,0,0,0,0,2
Kec. Logas Tanah Darat Kab. Kuantan Singingi,0,0,0,0,0,0
Kec. Inuman Kab. Kuantan Singingi,0,0,0,0,0,0
Kec. Singingi Hilir Kab. Kuantan Singingi,0,0,0,0,0,0
Kec. Hulu Kuantan Kab. Kuantan Singingi,0,0,0,0,0,0
Kec. Gunung Toar Kab. Kuantan Singingi,0,0,0,0,0,0
Kec. Kuantan Hilir Seberang Kab. Kuantan Singingi,0,0,0,0,0,0
Kec. Sentajo Raya Kab. Kuantan Singingi,2,0,0,0,0,2
Kec. Merbau Kab. Kepulauan Meranti,2,0,0,0,0,2
Kec. Rangsang Kab. Kepulauan Meranti,0,0,0,0,0,0
Kec. Rangsang Barat Kab. Kepulauan Meranti,0,0,0,0,0,0
Kec. Tebing Tinggi Kab. Kepulauan Meranti,8,0,0,0,0,8
Kec. Tebing Tinggi Barat Kab. Kepulauan Meranti,0,0,0,0,0,0
Kec. Tasik Putri Puyu Kab. Kepulauan Meranti,0,0,0,0,0,0
Kec. Pulau Merbau Kab. Kepulauan Meranti,2,0,0,0,0,2
Kec. Tebing Tinggi Timur Kab. Kepulauan Meranti,0,0,0,0,0,0
Kec. Rangsang Pesisir Kab. Kepulauan Meranti,2,0,0,0,0,2
Kec. XIII Koto Kampar Kab. Kampar,2,2,0,0,0,4
Kec. Kampar Kiri Kab. Kampar,2,0,0,0,0,2
Kec. Kampar Kab. Kampar,0,0,0,0,0,0
Kec. Tambang Kab. Kampar,4,0,0,0,0,4
Kec. Bangkinang Kab. Kampar,0,0,0,0,0,0
Kec. Kuok Kab. Kampar,1,1,0,0,0,2
Kec. Siak Hulu Kab. Kampar,8,2,0,0,0,10
Kec. Tapung Kab. Kampar,5,3,0,0,0,8
Kec. Kampar Kiri Hulu Kab. Kampar,2,0,0,0,0,2
Kec. Kampar Kiri Hilir Kab. Kampar,2,0,0,0,0,2
Kec. Tapung Hulu Kab. Kampar,8,0,0,0,0,8
Kec. Tapung Hilir Kab. Kampar,3,1,0,0,0,4
Kec. Salo Kab. Kampar,0,0,0,0,0,0
Kec. Rumbio Jaya Kab. Kampar,0,0,0,0,0,0
Kec. Bangkinang Kota Kab. Kampar,9,1,0,0,0,10
Kec. Perhentian Raja Kab. Kampar,1,1,0,0,0,2
Kec. Kampa Kab. Kampar,4,0,0,0,0,4
Kec. Kampar Utara Kab. Kampar,0,0,0,0,0,0
Kec. Kampar Kiri Tengah Kab. Kampar,3,1,0,0,0,4
Kec. Gunung Sahilan Kab. Kampar,2,0,0,0,0,2
Kec. Koto Kampar Hulu Kab. Kampar,1,1,0,0,0,2
Kec. Mandau Kab. Bengkalis,21,5,0,0,0,26
Kec. Bengkalis Kab. Bengkalis,8,1,0,0,0,9
Kec. Bantan Kab. Bengkalis,1,1,0,0,0,2
Kec. Bukit Batu Kab. Bengkalis,6,0,0,0,0,6
Kec. Rupat Kab. Bengkalis,2,2,0,0,0,4
Kec. Rupat Utara Kab. Bengkalis,2,0,0,0,0,2
Kec. Siak Kecil Kab. Bengkalis,0,0,0,0,0,0
Kec. Pinggir Kab. Bengkalis,10,1,0,0,0,11
Kec. Bathin Solapan Kab. Bengkalis,0,0,0,0,0,0
Kec. Talang Muandau Kab. Bengkalis,0,0,0,0,0,0
Kec. Tampan Kota Pekanbaru,20,2,0,0,0,22
Kec. Bukit Raya Kota Pekanbaru,9,1,0,0,0,10
Kec. Lima Puluh Kota Pekanbaru,9,1,0,0,0,10
Kec. Sail Kota Pekanbaru,5,3,0,0,0,8
Kec. Pekanbaru Kota Kota Pekanbaru,1,1,0,0,0,2
Kec. Sukajadi Kota Pekanbaru,8,2,0,0,0,10
Kec. Senapelan Kota Pekanbaru,6,2,0,0,0,8
Kec. Rumbai Kota Pekanbaru,1,1,0,0,0,2
Kec. Tenayan Raya Kota Pekanbaru,10,2,0,0,0,12
Kec. Marpoyan Damai Kota Pekanbaru,6,2,0,0,0,8
Kec. Rumbai Pesisir Kota Pekanbaru,12,0,0,0,0,12
Kec. Payung Sekaki Kota Pekanbaru,14,6,0,0,0,20
Kec. Bukit Kapur Kota Dumai,2,0,0,0,0,2
Kec. Dumai Barat Kota Dumai,2,0,0,0,0,2
Kec. Dumai Timur Kota Dumai,2,0,0,0,0,2
Kec. Medang Kampai Kota Dumai,0,0,0,0,0,0
Kec. Sungai Sembilan Kota Dumai,0,0,0,0,0,0
Kec. Dumai Kota Kota Dumai,3,1,0,0,0,4
Kec. Dumai Selatan Kota Dumai,6,2,0,0,0,8
Kec. Kubu Kab. Rokan Hilir,2,0,0,0,0,2
Kec. Bangko Kab. Rokan Hilir,30,4,0,0,0,34
Kec. Tanah Putih Kab. Rokan Hilir,9,1,0,0,0,10
Kec. Rimba Melintang Kab. Rokan Hilir,3,1,0,0,0,4
Kec. Bagan Sinembah Kab. Rokan Hilir,14,6,0,0,0,20
Kec. Pasir Limau Kapas Kab. Rokan Hilir,9,2,0,0,0,11
Kec. Sinaboi Kab. Rokan Hilir,2,0,0,0,0,2
Kec. Tanah Pth Tanjung Melawan Kab. Rokan Hilir,2,0,0,0,0,2
Kec. Pujud Kab. Rokan Hilir,2,7,0,0,0,9
Kec. Bangko Pusako Kab. Rokan Hilir,6,2,0,0,0,8
Kec. Simpang Kanan Kab. Rokan Hilir,1,1,0,0,0,2
Kec. Batu Hampar Kab. Rokan Hilir,2,0,0,0,0,2
Kec. Rantau Kopar Kab. Rokan Hilir,2,0,0,0,0,2
Kec. Pekaitan Kab. Rokan Hilir,0,0,0,0,0,0
Kec. Kubu Babussalam Kab. Rokan Hilir,6,0,0,0,0,6
Kec. Minas Kab. Siak,0,2,0,0,0,2
Kec. Siak Kab. Siak,3,1,0,0,0,4
Kec. Sungai Apit Kab. Siak,0,0,0,0,0,0
Kec. Tualang Kab. Siak,4,0,0,0,0,4
Kec. Kerinci Kanan Kab. Siak,0,0,0,0,0,0
Kec. Dayun Kab. Siak,0,0,0,0,0,0
Kec. Bunga Raya Kab. Siak,0,0,0,0,0,0
Kec. Sungai Mandau Kab. Siak,0,2,0,0,0,2
Kec. Kandis Kab. Siak,5,1,0,0,0,6
Kec. Lubuk Dalam Kab. Siak,2,0,0,0,0,2
Kec. Koto Gasib Kab. Siak,2,0,0,0,0,2
Kec. Pusako Kab. Siak,0,0,0,0,0,0
Kec. Sabak Auh Kab. Siak,2,2,0,0,0,4
Kec. Mempura Kab. Siak,0,0,0,0,0,0
Kec. Peranap Kab. Indragiri Hulu,4,2,0,0,0,6
Kec. Pasir Penyu Kab. Indragiri Hulu,5,1,0,0,0,6
Kec. Kelayang Kab. Indragiri Hulu,4,0,0,0,0,4
Kec. Seberida Kab. Indragiri Hulu,0,0,0,0,0,0
Kec. Rengat Kab. Indragiri Hulu,6,2,0,0,0,8
Kec. Rengat Barat Kab. Indragiri Hulu,4,0,0,0,0,4
Kec. Lirik Kab. Indragiri Hulu,2,0,0,0,0,2
Kec. Batang Gansal Kab. Indragiri Hulu,0,0,0,0,0,0
Kec. Batang Cenaku Kab. Indragiri Hulu,3,1,0,0,0,4
Kec. Lubuk Batu Jaya Kab. Indragiri Hulu,0,0,0,0,0,0
Kec. Sei Lala Kab. Indragiri Hulu,2,0,0,0,0,2
Kec. Rakit Kulim Kab. Indragiri Hulu,3,1,0,0,0,4
Kec. Kuala Cenaku Kab. Indragiri Hulu,0,0,0,0,0,0
Kec. Keritang Kab. Indragiri Hilir,4,0,0,0,0,4
Kec. Reteh Kab. Indragiri Hilir,2,0,0,0,0,2
Kec. Enok Kab. Indragiri Hilir,4,0,0,0,0,4
Kec. Tanah Merah Kab. Indragiri Hilir,1,1,0,0,0,2
Kec. Kuala Indragiri Kab. Indragiri Hilir,0,4,0,0,0,4
Kec. Tembilahan Kab. Indragiri Hilir,14,0,0,0,0,14
Kec. Tempuling Kab. Indragiri Hilir,0,0,0,0,0,0
Kec. Batang Tuaka Kab. Indragiri Hilir,0,0,0,0,0,0
Kec. Gaung Anak Serka Kab. Indragiri Hilir,3,1,0,0,0,4
Kec. Gaung Kab. Indragiri Hilir,3,1,0,0,0,4
Kec. Mandah Kab. Indragiri Hilir,1,1,0,0,0,2
Kec. Kateman Kab. Indragiri Hilir,2,0,0,0,0,2
Kec. Kemuning Kab. Indragiri Hilir,1,1,0,0,0,2
Kec. Pelangiran Kab. Indragiri Hilir,0,0,0,0,0,0
Kec. Pulau Burung Kab. Indragiri Hilir,1,1,0,0,0,2
Kec. Teluk Belengkong Kab. Indragiri Hilir,2,2,0,0,0,4
Kec. Tembilahan Hulu Kab. Indragiri Hilir,2,0,0,0,0,2
Kec. Concong Kab. Indragiri Hilir,2,0,0,0,0,2
Kec. Kempas Kab. Indragiri Hilir,0,0,0,0,0,0
Kec. Sungai Batang Kab. Indragiri Hilir,0,0,0,0,0,0
Kec. Rimbo Bujang Kab. Tebo,5,1,0,0,0,6
Kec. Tebo Ilir Kab. Tebo,0,0,0,0,0,0
Kec. Tebo Tengah Kab. Tebo,3,1,0,0,0,4
Kec. Tebo Ulu Kab. Tebo,2,0,0,0,0,2
Kec. Sumay Kab. Tebo,0,0,0,0,0,0
Kec. VII Koto Kab. Tebo,3,1,0,0,0,4
Kec. Rimbo Ilir Kab. Tebo,3,0,0,0,0,3
Kec. Rimbo Ulu Kab. Tebo,5,1,0,0,0,6
Kec. Tengah Ilir Kab. Tebo,0,0,0,0,0,0
Kec. Serai Serumpun Kab. Tebo,0,4,0,0,0,4
Kec. Muara Tabir Kab. Tebo,1,1,0,0,0,2
Kec. Kota Baru Kota Jambi,12,2,0,0,0,14
Kec. Jambi Selatan Kota Jambi,10,4,0,0,0,14
Kec. Jelutung Kota Jambi,14,1,0,0,0,15
Kec. Telanai Pura Kota Jambi,10,2,0,0,0,12
Kec. Danau Teluk Kota Jambi,1,0,0,0,0,1
Kec. Jambi Timur Kota Jambi,9,1,0,0,0,10
Kec. Alam Barajo Kota Jambi,6,2,0,0,0,8
Kec. Danau Sipin Kota Jambi,12,6,0,0,0,18
Kec. Paal Merah Kota Jambi,10,5,0,0,0,15
Kec. Sungai Penuh Kota Sungai Penuh,5,0,0,0,0,5
Kec. Hamparan Rawang Kota Sungai Penuh,0,0,0,0,0,0
Kec. Pondok Tinggi Kota Sungai Penuh,0,0,0,0,0,0
Kec. Koto Baru Kota Sungai Penuh,2,0,0,0,0,2
Kec. Sungai Bungkal Kota Sungai Penuh,0,0,0,0,0,0
Kec. Mersam Kab. Batang Hari,2,0,0,0,0,2
Kec. Muara Tembesi Kab. Batang Hari,0,0,0,0,0,0
Kec. Batin XXIV Kab. Batang Hari,3,1,0,0,0,4
Kec. Muara Bulian Kab. Batang Hari,14,1,0,0,0,15
Kec. Pemayung Kab. Batang Hari,3,1,0,0,0,4
Kec. Maro Sebo Ulu Kab. Batang Hari,2,0,0,0,0,2
Kec. Bajubang Kab. Batang Hari,2,0,0,0,0,2
Kec. Maro Sebo Ilir Kab. Batang Hari,0,0,0,0,0,0
Kec. Tanah Tumbuh Kab. Bungo,0,0,0,0,0,0
Kec. Tanah Sepenggal Kab. Bungo,0,0,0,0,0,0
Kec. Jujuhan Kab. Bungo,0,0,0,0,0,0
Kec. Rantau Pandan Kab. Bungo,3,1,0,0,0,4
Kec. Pelepat Kab. Bungo,0,0,0,0,0,0
Kec. Pelepat Ilir Kab. Bungo,3,1,0,0,0,4
Kec. Limbur Lubuk Mengkuang Kab. Bungo,0,0,0,0,0,0
Kec. Bathin II Babeko Kab. Bungo,2,0,0,0,0,2
Kec. Muko Muko Batin VII Kab. Bungo,0,0,0,0,0,0
Kec. Bathin III Kab. Bungo,2,0,0,0,0,2
Kec. Bathin II Pelayang Kab. Bungo,0,0,0,0,0,0
Kec. Jujuhan Ilir Kab. Bungo,0,0,0,0,0,0
Kec. Rimbo Tengah Kab. Bungo,7,1,0,0,0,8
Kec. Tanah Sepenggal Lintas Kab. Bungo,1,3,0,0,0,4
Kec. Jambi Luar Kota Kab. Muaro Jambi,7,2,0,0,0,9
Kec. Mestong Kab. Muaro Jambi,3,0,0,0,0,3
Kec. Kumpeh Ulu Kab. Muaro Jambi,1,3,0,0,0,4
Kec. Sekernan Kab. Muaro Jambi,0,2,0,0,0,2
Kec. Maro Sebo Kab. Muaro Jambi,2,0,0,0,0,2
Kec. Kumpeh Kab. Muaro Jambi,0,0,0,0,0,0
Kec. Sungai Bahar Kab. Muaro Jambi,4,0,0,0,0,4
Kec. Sungai Gelam Kab. Muaro Jambi,4,1,0,0,0,5
Kec. Bahar Utara Kab. Muaro Jambi,0,0,0,0,0,0
Kec. Bahar Selatan Kab. Muaro Jambi,2,0,0,0,0,2
Kec. Mendahara Kab. Tanjung Jabung Timur,0,0,0,0,0,0
Kec. Dendang Kab. Tanjung Jabung Timur,0,0,0,0,0,0
Kec. Nipah Panjang Kab. Tanjung Jabung Timur,2,0,0,0,0,2
Kec. Rantau Rasau Kab. Tanjung Jabung Timur,2,0,0,0,0,2
Kec. Sadu Kab. Tanjung Jabung Timur,0,0,0,0,0,0
Kec. Geragai Kab. Tanjung Jabung Timur,2,0,0,0,0,2
Kec. Muara Sabak Barat Kab. Tanjung Jabung Timur,0,0,0,0,0,0
Kec. Kuala Jambi Kab. Tanjung Jabung Timur,1,1,0,0,0,2
Kec. Berbak Kab. Tanjung Jabung Timur,0,0,0,0,0,0
Kec. Muara Sabak Timur Kab. Tanjung Jabung Timur,2,2,0,0,0,4
Kec. Jangkat Kab. Merangin,0,0,0,0,0,0
Kec. Bangko Kab. Merangin,2,2,0,0,0,4
Kec. Pamenang Kab. Merangin,1,0,1,0,0,2
Kec. Muara Siau Kab. Merangin,0,0,0,0,0,0
Kec. Sungai Manau Kab. Merangin,1,1,0,0,0,2
Kec. Tabir Kab. Merangin,2,0,0,0,0,2
Kec. Tabir Ulu Kab. Merangin,1,1,0,0,0,2
Kec. Lembah Masurai Kab. Merangin,0,0,0,0,0,0
Kec. Tabir Selatan Kab. Merangin,0,0,0,0,0,0
Kec. Nalo Tantan Kab. Merangin,0,0,0,0,0,0
Kec. Batang Masumai Kab. Merangin,3,1,0,0,0,4
Kec. Pamenang Barat Kab. Merangin,0,2,0,0,0,2
Kec. Renah Pemparap Kab. Merangin,0,0,0,0,0,0
Kec. Jangkat Timur Kab. Merangin,1,1,0,0,0,2
Kec. Tiang Pumpung Kab. Merangin,2,0,0,0,0,2
Kec. Renah Pamenang  Kab. Merangin,2,0,0,0,0,2
Kec. Tabir Lintas Kab. Merangin,0,0,0,0,0,0
Kec. Margo Tabir Kab. Merangin,5,1,0,0,0,6
Kec. Tabir Barat Kab. Merangin,0,0,0,0,0,0
Kec. Batang Asai Kab. Sarolangun,1,1,0,0,0,2
Kec. Limun Kab. Sarolangun,0,0,0,0,0,0
Kec. Sarolangun Kab. Sarolangun,4,0,0,0,0,4
Kec. Pelawan Kab. Sarolangun,5,1,0,0,0,6
Kec. Pauh Kab. Sarolangun,3,1,0,0,0,4
Kec. Mandiangin Kab. Sarolangun,1,1,0,0,0,2
Kec. Air Hitam Kab. Sarolangun,0,0,0,0,0,0
Kec. Bathin VIII Kab. Sarolangun,0,0,0,0,0,0
Kec. Singkut Kab. Sarolangun,3,3,0,0,0,6
Kec. Cermin Nan Gedang Kab. Sarolangun,0,2,0,0,0,2
Kec. Tungkal Ulu Kab. Tanjung Jabung Barat,4,2,0,0,0,6
Kec. Pengabuan Kab. Tanjung Jabung Barat,1,1,0,0,0,2
Kec. Tungkal Ilir Kab. Tanjung Jabung Barat,6,0,0,0,0,6
Kec. Betara Kab. Tanjung Jabung Barat,1,0,0,0,0,1
Kec. Merlung Kab. Tanjung Jabung Barat,1,1,0,0,0,2
Kec. Batang Asam Kab. Tanjung Jabung Barat,1,0,0,0,0,1
Kec. Tebing Tinggi Kab. Tanjung Jabung Barat,2,2,0,0,0,4
Kec. Renah Mendaluh Kab. Tanjung Jabung Barat,2,0,0,0,0,2
Kec. Muara Papalik Kab. Tanjung Jabung Barat,1,2,0,0,0,3
Kec. Senyerang Kab. Tanjung Jabung Barat,3,1,0,0,0,4
Kec. Bram Itam Kab. Tanjung Jabung Barat,0,0,0,0,0,0
Kec. Kuala Betara Kab. Tanjung Jabung Barat,0,0,0,0,0,0
Kec. Gunung Raya Kab. Kerinci,4,0,0,0,0,4
Kec. Batang Merangin Kab. Kerinci,1,1,0,0,0,2
Kec. Keliling Danau Kab. Kerinci,3,1,0,0,0,4
Kec. Danau Kerinci Kab. Kerinci,0,0,0,0,0,0
Kec. Sitinjau Laut Kab. Kerinci,2,0,0,0,0,2
Kec. Gunung Kerinci Kab. Kerinci,0,0,0,0,0,0
Kec. Kayu Aro Kab. Kerinci,1,1,0,0,0,2
Kec. Air Hangat Timur Kab. Kerinci,2,0,0,0,0,2
Kec. Siulak Kab. Kerinci,1,1,0,0,0,2
Kec. Bukit Kerman Kab. Kerinci,1,1,0,0,0,2
Kec. Air Hangat Barat Kab. Kerinci,0,0,0,0,0,0
Kec. Siulak Mukai Kab. Kerinci,0,0,0,0,0,0
Kec. Tanjung Raja Kab. Ogan Ilir,6,2,0,0,0,8
Kec. Muara Kuang Kab. Ogan Ilir,1,1,0,0,0,2
Kec. Tanjung Batu Kab. Ogan Ilir,4,0,0,0,0,4
Kec. Indralaya Kab. Ogan Ilir,3,1,0,0,0,4
Kec. Pemulutan Kab. Ogan Ilir,0,0,0,0,0,0
Kec. Rantau Alai Kab. Ogan Ilir,0,2,0,0,0,2
Kec. Rambang Kuang Kab. Ogan Ilir,2,0,0,0,0,2
Kec. Lubuk Keliat Kab. Ogan Ilir,2,0,0,0,0,2
Kec. Payaraman Kab. Ogan Ilir,2,0,0,0,0,2
Kec. Kandis Kab. Ogan Ilir,2,0,0,0,0,2
Kec. Pemulutan Selatan Kab. Ogan Ilir,2,0,0,0,0,2
Kec. Pemulutan Barat Kab. Ogan Ilir,2,0,0,0,0,2
Kec. Indralaya Selatan Kab. Ogan Ilir,0,2,0,0,0,2
Kec. Indralaya Utara Kab. Ogan Ilir,1,1,0,0,0,2
Kec. Rantau Panjang Kab. Ogan Ilir,1,1,0,0,0,2
Kec. Sungai Pinang Kab. Ogan Ilir,0,0,0,0,0,0
Kec. Lintang Kanan Kab. Empat Lawang,0,0,0,0,0,0
Kec. Muara Pinang Kab. Empat Lawang,1,1,0,0,0,2
Kec. Pendopo Kab. Empat Lawang,0,0,0,0,0,0
Kec. Ulu Musi Kab. Empat Lawang,0,0,0,0,0,0
Kec. Tebing Tinggi Kab. Empat Lawang,10,0,0,0,0,10
Kec. Talang Padang Kab. Empat Lawang,0,0,0,0,0,0
Kec. Pasemah Air Keruh Kab. Empat Lawang,0,0,0,0,0,0
Kec. Sikap Dalam Kab. Empat Lawang,0,0,0,0,0,0
Kec. Saling Kab. Empat Lawang,2,0,0,0,0,2
Kec. Pendopo Barat Kab. Empat Lawang,0,2,0,0,0,2
Kec. Sanga Desa Kab. Musi Banyuasin,1,1,0,0,0,2
Kec. Babat Toman Kab. Musi Banyuasin,2,2,0,0,0,4
Kec. Sungai Keruh Kab. Musi Banyuasin,6,0,0,0,0,6
Kec. Sekayu Kab. Musi Banyuasin,10,6,0,0,0,16
Kec. Sungai Lilin Kab. Musi Banyuasin,9,1,0,0,0,10
Kec. Bayung Lencir Kab. Musi Banyuasin,2,0,0,0,0,2
Kec. Lais Kab. Musi Banyuasin,6,2,0,0,0,8
Kec. Batanghari Leko Kab. Musi Banyuasin,5,1,0,0,0,6
Kec. Keluang Kab. Musi Banyuasin,8,0,0,0,0,8
Kec. Plakat Tinggi Kab. Musi Banyuasin,4,1,0,0,0,5
Kec. Lalan Kab. Musi Banyuasin,1,3,0,0,0,4
Kec. Tungkal Jaya Kab. Musi Banyuasin,3,1,0,0,0,4
Kec. Lawang Wetan Kab. Musi Banyuasin,4,2,0,0,0,6
Kec. Babat Supat Kab. Musi Banyuasin,6,0,0,0,0,6
Kec. Rantau Bayur Kab. Banyuasin,0,0,0,0,0,0
Kec. Talang Kelapa Kab. Banyuasin,8,0,0,0,0,8
Kec. Banyuasin III Kab. Banyuasin,11,1,0,0,0,12
Kec. Betung Kab. Banyuasin,2,0,0,0,0,2
Kec. Makarti Jaya Kab. Banyuasin,2,2,0,0,0,4
Kec. Banyuasin I Kab. Banyuasin,6,2,0,0,0,8
Kec. Banyuasin II Kab. Banyuasin,1,1,0,0,0,2
Kec. Rambutan Kab. Banyuasin,2,0,0,0,0,2
Kec. Muara Telang Kab. Banyuasin,1,1,0,0,0,2
Kec. Muara Padang Kab. Banyuasin,4,0,0,0,0,4
Kec. Tanjung Lago Kab. Banyuasin,2,2,0,0,0,4
Kec. Muara Sugihan Kab. Banyuasin,0,0,0,0,0,0
Kec. Air Salek Kab. Banyuasin,6,1,0,0,0,7
Kec. Tungkal Ilir Kab. Banyuasin,5,2,0,0,0,7
Kec. Suak Tapeh Kab. Banyuasin,0,0,0,0,0,0
Kec. Pulau Rimau Kab. Banyuasin,4,2,0,0,0,6
Kec. Sembawa Kab. Banyuasin,0,2,0,0,0,2
Kec. Sumber Marga Telang Kab. Banyuasin,2,0,0,0,0,2
Kec. Air Kumbang Kab. Banyuasin,2,2,0,0,0,4
Kec. Karang Agung Ilir Kab. Banyuasin,0,0,0,0,0,0
Kec. Pagar Alam Utara Kota Pagar Alam,4,2,0,0,0,6
Kec. Pagar Alam Selatan Kota Pagar Alam,5,3,0,0,0,8
Kec. Dempo Utara Kota Pagar Alam,2,0,0,0,0,2
Kec. Dempo Selatan Kota Pagar Alam,0,0,0,0,0,0
Kec. Dempo Tengah Kota Pagar Alam,3,1,0,0,0,4
Kec. Stl Ulu Terawas Kab. Musi Rawas,6,0,0,0,0,6
Kec. Tugu Mulyo Kab. Musi Rawas,2,2,0,0,0,4
Kec. Muara Beliti Kab. Musi Rawas,4,0,0,0,0,4
Kec. Jayaloka Kab. Musi Rawas,2,0,0,0,0,2
Kec. Muara Kelingi Kab. Musi Rawas,2,0,0,0,0,2
Kec. Muara Lakitan Kab. Musi Rawas,2,2,0,0,0,4
Kec. Megang Sakti Kab. Musi Rawas,4,0,0,0,0,4
Kec. Purwodadi Kab. Musi Rawas,4,0,0,0,0,4
Kec. Selangit Kab. Musi Rawas,2,2,0,0,0,4
Kec. Bulan Tengah Suku Ulu Kab. Musi Rawas,0,0,0,0,0,0
Kec. Tiang Pumpung Kepungut Kab. Musi Rawas,0,0,0,0,0,0
Kec. Sumber Harta Kab. Musi Rawas,1,1,0,0,0,2
Kec. Tuah Negeri Kab. Musi Rawas,4,0,0,0,0,4
Kec. Suka Karya Kab. Musi Rawas,3,1,0,0,0,4
Kec. Martapura Kab. Ogan Komering Ulu Timur,5,3,0,0,0,8
Kec. Buay Madang Kab. Ogan Komering Ulu Timur,6,2,0,0,0,8
Kec. Cempaka Kab. Ogan Komering Ulu Timur,3,1,0,0,0,4
Kec. Madang Suku I Kab. Ogan Komering Ulu Timur,2,0,0,0,0,2
Kec. Madang Suku II Kab. Ogan Komering Ulu Timur,0,0,0,0,0,0
Kec. Belitang II Kab. Ogan Komering Ulu Timur,2,0,0,0,0,2
Kec. Belitang III Kab. Ogan Komering Ulu Timur,1,1,0,0,0,2
Kec. Buay Pemuka Peliung Kab. Ogan Komering Ulu Timur,2,0,0,0,0,2
Kec. Semendawai Suku III Kab. Ogan Komering Ulu Timur,1,1,0,0,0,2
Kec. Buay Madang Timur Kab. Ogan Komering Ulu Timur,4,2,0,0,0,6
Kec. Madang Suku III Kab. Ogan Komering Ulu Timur,0,0,0,0,0,0
Kec. Semendawai Barat Kab. Ogan Komering Ulu Timur,1,2,0,0,0,3
Kec. Semendawai Timur Kab. Ogan Komering Ulu Timur,1,1,0,0,0,2
Kec. Jayapura Kab. Ogan Komering Ulu Timur,0,0,0,0,0,0
Kec. Belitang Jaya Kab. Ogan Komering Ulu Timur,1,0,0,0,0,1
Kec. Belitang Madang Raya Kab. Ogan Komering Ulu Timur,4,0,0,0,0,4
Kec. Belitang Kab. Ogan Komering Ulu Timur,8,4,0,0,0,12
Kec. Kota Agung Kab. Lahat,0,2,0,0,0,2
Kec. Pulau Pinang Kab. Lahat,2,0,0,0,0,2
Kec. Jarai Kab. Lahat,4,0,0,0,0,4
Kec. Kikim Timur Kab. Lahat,0,0,0,0,0,0
Kec. Lahat Kab. Lahat,23,5,0,0,0,28
Kec. Mulak Ulu Kab. Lahat,0,0,0,0,0,0
Kec. Pajar Bulan Kab. Lahat,1,1,0,0,0,2
Kec. Kikim Selatan Kab. Lahat,0,0,0,0,0,0
Kec. Kikim Barat Kab. Lahat,0,0,0,0,0,0
Kec. Kikim Tengah Kab. Lahat,4,0,0,0,0,4
Kec. Tanjung Sakti Pumi Kab. Lahat,1,1,0,0,0,2
Kec. Tanjung Sakti Pumu Kab. Lahat,2,0,0,0,0,2
Kec. Merapi Barat Kab. Lahat,0,0,0,0,0,0
Kec. Pseksu Kab. Lahat,0,0,0,0,0,0
Kec. Gumay Talang Kab. Lahat,2,0,0,0,0,2
Kec. Pagar Gunung Kab. Lahat,1,1,0,0,0,2
Kec. Merapi Timur Kab. Lahat,2,0,0,0,0,2
Kec. Gumay Ulu Kab. Lahat,2,0,0,0,0,2
Kec. Merapi Selatan Kab. Lahat,0,0,0,0,0,0
Kec. Tanjung Tebat Kab. Lahat,0,0,0,0,0,0
Kec. Muara Payang Kab. Lahat,0,0,0,0,0,0
Kec. Lempuing Kab. Ogan Komering Ilir,1,0,0,0,0,1
Kec. Mesuji Kab. Ogan Komering Ilir,4,2,0,0,0,6
Kec. Tulung Selapan Kab. Ogan Komering Ilir,2,0,0,0,0,2
Kec. Pedamaran Kab. Ogan Komering Ilir,3,1,0,0,0,4
Kec. Tanjung Lubuk Kab. Ogan Komering Ilir,2,0,0,0,0,2
Kec. Kota Kayu Agung Kab. Ogan Komering Ilir,11,3,0,0,0,14
Kec. Sirah Pulau Padang Kab. Ogan Komering Ilir,2,0,0,0,0,2
Kec. Pampangan Kab. Ogan Komering Ilir,1,1,0,0,0,2
Kec. Air Sugihan Kab. Ogan Komering Ilir,0,0,0,0,0,0
Kec. Cengal Kab. Ogan Komering Ilir,2,0,0,0,0,2
Kec. Jejawi Kab. Ogan Komering Ilir,0,0,0,0,0,0
Kec. Sungai Menang Kab. Ogan Komering Ilir,4,0,0,0,0,4
Kec. Lempuing Jaya Kab. Ogan Komering Ilir,4,0,0,0,0,4
Kec. Mesuji Makmur Kab. Ogan Komering Ilir,0,0,0,0,0,0
Kec. Mesuji Raya Kab. Ogan Komering Ilir,5,1,0,0,0,6
Kec. Pedamaran Timur Kab. Ogan Komering Ilir,0,0,0,0,0,0
Kec. Teluk Gelam Kab. Ogan Komering Ilir,0,0,0,0,0,0
Kec. Pangkalan Lapam Kab. Ogan Komering Ilir,2,0,0,0,0,2
Kec. Sosoh Buay Rayap Kab. Ogan Komering Ulu,1,1,0,0,0,2
Kec. Pengandonan Kab. Ogan Komering Ulu,1,1,0,0,0,2
Kec. Peninjauan Kab. Ogan Komering Ulu,2,0,0,0,0,2
Kec. Lubuk Batang Kab. Ogan Komering Ulu,2,0,0,0,0,2
Kec. Ulu Ogan Kab. Ogan Komering Ulu,0,0,0,0,0,0
Kec. Semidang Aji Kab. Ogan Komering Ulu,1,1,0,0,0,2
Kec. Lengkiti Kab. Ogan Komering Ulu,3,1,0,0,0,4
Kec. Baturaja Timur Kab. Ogan Komering Ulu,16,4,0,0,0,20
Kec. Baturaja Barat Kab. Ogan Komering Ulu,2,2,0,0,0,4
Kec. Sinar Peninjauan Kab. Ogan Komering Ulu,2,0,0,0,0,2
Kec. Lubuk Raja Kab. Ogan Komering Ulu,1,1,0,0,0,2
Kec. Semende Darat Laut Kab. Muara Enim,0,0,0,0,0,0
Kec. Tanjung Agung Kab. Muara Enim,1,1,0,0,0,2
Kec. Lawang Kidul Kab. Muara Enim,5,1,0,0,0,6
Kec. Muara Enim Kab. Muara Enim,9,3,0,0,0,12
Kec. Gunung Megang Kab. Muara Enim,2,0,0,0,0,2
Kec. Gelumbang Kab. Muara Enim,4,0,0,0,0,4
Kec. Sungai Rotan Kab. Muara Enim,4,2,0,0,0,6
Kec. Lembak Kab. Muara Enim,1,1,0,0,0,2
Kec. Ujan Mas Kab. Muara Enim,2,0,0,0,0,2
Kec. Lubai Kab. Muara Enim,0,0,0,0,0,0
Kec. Rambang Kab. Muara Enim,2,0,0,0,0,2
Kec. Semende Darat Ulu Kab. Muara Enim,2,0,0,0,0,2
Kec. Semende Darat Tengah Kab. Muara Enim,0,0,0,0,0,0
Kec. Rambang Niru Kab. Muara Enim,1,1,0,0,0,2
Kec. Kelekar Kab. Muara Enim,0,0,0,0,0,0
Kec. Muara Belida Kab. Muara Enim,0,0,0,0,0,0
Kec. Lubai Ulu Kab. Muara Enim,0,1,0,0,0,1
Kec. Belimbing Kab. Muara Enim,0,2,0,0,0,2
KEC. PENUKAL UTARA Kab. Penukal Abab Lematang Ilir,2,0,0,0,0,2
KEC. ABAB Kab. Penukal Abab Lematang Ilir,2,0,0,0,0,2
KEC. TANAH ABANG Kab. Penukal Abab Lematang Ilir,6,2,0,0,0,8
KEC. TALANG UBI Kab. Penukal Abab Lematang Ilir,4,4,0,0,0,8
Kec. Penukal Kab. Penukal Abab Lematang Ilir,0,2,0,0,0,2
Kec. Rupit Kab. Musi Rawas Utara,3,1,0,0,0,4
Kec. Rawas Ulu Kab. Musi Rawas Utara,2,0,0,0,0,2
Kec. Nibung Kab. Musi Rawas Utara,2,0,0,0,0,2
Kec. Rawas IIlir Kab. Musi Rawas Utara,0,0,0,0,0,0
Kec. Karang Dapo Kab. Musi Rawas Utara,0,0,0,0,0,0
Kec. Karang Jaya Kab. Musi Rawas Utara,2,0,0,0,0,2
Kec. Ulu Rawas Kab. Musi Rawas Utara,0,0,0,0,0,0
Kec. Ilir Barat II Kota Palembang,3,5,0,0,0,8
Kec. Seberang Ulu I Kota Palembang,28,6,0,0,0,34
Kec. Seberang Ulu II Kota Palembang,16,4,0,0,0,20
Kec. Ilir Barat I Kota Palembang,25,5,0,0,0,30
Kec. Ilir Timur I Kota Palembang,11,3,0,0,0,14
Kec. Ilir Timur II Kota Palembang,34,8,0,0,0,42
Kec. Sako Kota Palembang,2,4,0,0,0,6
Kec. Sukarami Kota Palembang,12,8,0,0,0,20
Kec. Kemuning Kota Palembang,25,1,0,0,0,26
Kec. Plaju Kota Palembang,11,5,0,0,0,16
Kec. Kertapati Kota Palembang,5,6,0,0,0,11
Kec. Gandus Kota Palembang,4,4,0,0,0,8
Kec. Bukit Kecil Kota Palembang,2,2,0,0,0,4
Kec. Kalidoni Kota Palembang,12,4,0,0,0,16
Kec. Alang-Alang Lebar Kota Palembang,6,0,0,0,0,6
Kec. Sematang Borang Kota Palembang,0,0,0,0,0,0
Kec. Prabumulih Timur Kota Prabumulih,6,4,0,0,0,10
Kec. Prabumulih Barat Kota Prabumulih,4,2,0,0,0,6
Kec. Cambai Kota Prabumulih,2,0,0,0,0,2
Kec. Rambang Kapak Tengah Kota Prabumulih,0,2,0,0,0,2
Kec. Prabumulih Utara Kota Prabumulih,6,2,0,0,0,8
Kec. Prabumulih Selatan Kota Prabumulih,1,3,0,0,0,4
Kec. Lubuk Linggau Barat I Kota Lubuk Linggau,4,2,0,0,0,6
Kec. Lubuk Linggau Timur I Kota Lubuk Linggau,10,2,0,0,0,12
Kec. Lubuk Linggau Selatan I Kota Lubuk Linggau,2,0,0,0,0,2
Kec. Lubuk Linggau Utara I Kota Lubuk Linggau,4,0,0,0,0,4
Kec. Lubuk Linggau Barat II Kota Lubuk Linggau,2,2,0,0,0,4
Kec. Lubuk Linggau Timur II Kota Lubuk Linggau,4,0,0,0,0,4
Kec. Lubuk Linggau Selatan II Kota Lubuk Linggau,2,0,0,0,0,2
Kec. Lubuk Linggau Utara II Kota Lubuk Linggau,2,0,0,0,0,2
Kec. Banding Agung Kab. Ogan Komering Ulu Selatan,1,1,0,0,0,2
Kec. Pulau Beringin Kab. Ogan Komering Ulu Selatan,2,0,0,0,0,2
Kec. Muaradua Kisam Kab. Ogan Komering Ulu Selatan,0,0,0,0,0,0
Kec. Muaradua Kab. Ogan Komering Ulu Selatan,2,0,0,0,0,2
Kec. Simpang Kab. Ogan Komering Ulu Selatan,0,0,0,0,0,0
Kec. Buay Sandang Aji Kab. Ogan Komering Ulu Selatan,0,0,0,0,0,0
Kec. Buay Runjung Kab. Ogan Komering Ulu Selatan,2,0,0,0,0,2
Kec. Buay Pemaca Kab. Ogan Komering Ulu Selatan,2,0,0,0,0,2
Kec. Mekakau Ilir Kab. Ogan Komering Ulu Selatan,0,0,0,0,0,0
Kec. Kisam Tinggi Kab. Ogan Komering Ulu Selatan,0,0,0,0,0,0
Kec. Kisam Ilir Kab. Ogan Komering Ulu Selatan,0,0,0,0,0,0
