Kec. Ujung Loe Kab. Bulukumba,1,1,0,0,0,2
Kec. Sinjai Barat Kab. Sinjai,1,1,0,0,0,2
Kec. Sinjai Borong Kab. Sinjai,4,0,0,0,0,4
Kec. Sinjai Selatan Kab. Sinjai,3,1,0,0,0,4
Kec. Tellu Limpoe Kab. Sinjai,0,0,0,0,0,0
Kec. Sinjai Timur Kab. Sinjai,2,0,0,0,0,2
Kec. Sinjai Tengah Kab. Sinjai,2,0,0,0,0,2
Kec. Sinjai Utara Kab. Sinjai,4,0,0,0,0,4
Kec. Bulupoddo Kab. Sinjai,0,0,0,0,0,0
Kec. Pasimarannu Kab. Kepulauan Selayar,0,2,0,0,0,2
Kec. Bontosikuyu Kab. Kepulauan Selayar,1,1,0,0,0,2
Kec. Bontoharu Kab. Kepulauan Selayar,2,2,0,0,0,4
Kec. Bontomatene Kab. Kepulauan Selayar,1,1,0,0,0,2
Kec. Bontomanai Kab. Kepulauan Selayar,2,0,0,0,0,2
Kec. Benteng Kab. Kepulauan Selayar,2,0,0,0,0,2
Kec. Taka Bonerate Kab. Kepulauan Selayar,0,0,0,0,0,0
Kec. Pasimasunggu Timur Kab. Kepulauan Selayar,0,0,0,0,0,0
Kec. Buki Kab. Kepulauan Selayar,0,0,0,0,0,0
Kec. Suppa Kab. Pinrang,0,2,0,0,0,2
Kec. Mattiro Sompe Kab. Pinrang,1,1,0,0,0,2
Kec. Mattiro Bulu Kab. Pinrang,2,0,0,0,0,2
Kec. Watang Sawitto Kab. Pinrang,5,3,0,0,0,8
Kec. Patampanua Kab. Pinrang,2,0,0,0,0,2
Kec. Cempa Kab. Pinrang,0,0,0,0,0,0
Kec. Duampanua Kab. Pinrang,1,1,0,0,0,2
Kec. Lembang Kab. Pinrang,1,1,0,0,0,2
Kec. Lanrisang Kab. Pinrang,0,1,0,0,0,1
Kec. Tiroang Kab. Pinrang,0,2,0,0,0,2
Kec. Paleteang Kab. Pinrang,2,0,0,0,0,2
Kec. Tanete Riaja Kab. Barru,1,1,0,0,0,2
Kec. Tanete Rilau Kab. Barru,0,2,0,0,0,2
Kec. Barru Kab. Barru,5,1,0,0,0,6
Kec. Soppeng Riaja Kab. Barru,1,1,0,0,0,2
Kec. Mallusetasi Kab. Barru,1,1,0,0,0,2
Kec. Balusu Kab. Barru,1,1,0,0,0,2
Kec. Bontocani Kab. Bone,1,1,0,0,0,2
Kec. Kahu Kab. Bone,6,2,0,0,0,8
Kec. Kajuara Kab. Bone,2,0,0,0,0,2
Kec. Salomekko Kab. Bone,1,1,0,0,0,2
Kec. Tonra Kab. Bone,0,0,0,0,0,0
Kec. Patimpeng Kab. Bone,0,0,0,0,0,0
Kec. Libureng Kab. Bone,3,1,0,0,0,4
Kec. Mare Kab. Bone,2,0,0,0,0,2
Kec. Sibulue Kab. Bone,2,0,0,0,0,2
Kec. Cina Kab. Bone,4,0,0,0,0,4
Kec. Ponre Kab. Bone,0,0,0,0,0,0
Kec. Lappariaja Kab. Bone,2,0,0,0,0,2
Kec. Lamuru Kab. Bone,1,1,0,0,0,2
Kec. Bengo Kab. Bone,0,0,0,0,0,0
Kec. Ulaweng Kab. Bone,1,1,0,0,0,2
Kec. Palakka Kab. Bone,2,0,0,0,0,2
Kec. Awangpone Kab. Bone,2,0,0,0,0,2
Kec. Tellu Siattinge Kab. Bone,2,0,0,0,0,2
Kec. Amali Kab. Bone,0,0,0,0,0,0
Kec. Ajangale Kab. Bone,2,0,0,0,0,2
Kec. Dua Boccoe Kab. Bone,0,0,0,0,0,0
Kec. Cenrana Kab. Bone,4,0,0,0,0,4
Kec. Tanete Riattang Barat Kab. Bone,9,3,0,0,0,12
Kec. Tanete Riattang Kab. Bone,1,1,0,0,0,2
Kec. Tanete Riattang Timur Kab. Bone,3,1,0,0,0,4
Kec. Tellu Limpoe Kab. Bone,0,0,0,0,0,0
Kec. Sabbangparu Kab. Wajo,0,0,0,0,0,0
Kec. Tempe Kab. Wajo,3,3,0,0,0,6
Kec. Pammana Kab. Wajo,3,1,0,0,0,4
Kec. Bola Kab. Wajo,2,0,0,0,0,2
Kec. Takkalala Kab. Wajo,1,1,0,0,0,2
Kec. Sajo Anging Kab. Wajo,1,1,0,0,0,2
Kec. Majauleng Kab. Wajo,1,1,0,0,0,2
Kec. Belawa Kab. Wajo,0,0,0,0,0,0
Kec. Maniang Pajo Kab. Wajo,1,1,0,0,0,2
Kec. Keera Kab. Wajo,2,0,0,0,0,2
Kec. Pitumpanua Kab. Wajo,0,0,0,0,0,0
Kec. Penrang Kab. Wajo,1,1,0,0,0,2
Kec. Marioriwawo Kab. Soppeng,2,0,0,0,0,2
Kec. Lalabata Kab. Soppeng,10,0,0,0,0,10
Kec. Liliriaja Kab. Soppeng,1,1,0,0,0,2
Kec. Lili Rilau Kab. Soppeng,4,0,0,0,0,4
Kec. Donri-Donri Kab. Soppeng,1,1,0,0,0,2
Kec. Mario Riawa Kab. Soppeng,2,2,0,0,0,4
Kec. Bissappu Kab. Bantaeng,0,0,0,0,0,0
Kec. Bantaeng Kab. Bantaeng,1,1,0,0,0,2
Kec. Tompobulu Kab. Bantaeng,0,0,0,0,0,0
Kec. Ulu Ere Kab. Bantaeng,0,0,0,0,0,0
Kec. Ere Merasa Kab. Bantaeng,2,0,0,0,0,2
Kec. Pa`jukukang Kab. Bantaeng,1,1,0,0,0,2
Kec. Gantarang Keke Kab. Bantaeng,1,1,0,0,0,2
Kec. Mandai Kab. Maros,6,2,0,0,0,8
Kec. Maros Baru Kab. Maros,2,0,0,0,0,2
Kec. Maros Utara / Bontoa Kab. Maros,0,0,0,0,0,0
Kec. Bantimurung Kab. Maros,5,1,0,0,0,6
Kec. Tanralili Kab. Maros,3,1,0,0,0,4
Kec. Camba Kab. Maros,6,0,0,0,0,6
Kec. Mallawa Kab. Maros,2,0,0,0,0,2
Kec. Moncongloe Kab. Maros,2,0,0,0,0,2
Kec. Turikale Kab. Maros,3,3,0,0,0,6
Kec. Marusu Kab. Maros,0,0,0,0,0,0
Kec. Lau Kab. Maros,1,3,0,0,0,4
Kec. Simbang Kab. Maros,2,0,0,0,0,2
Kec. Tompobulu Kab. Maros,2,0,0,0,0,2
Kec. Cenrana Kab. Maros,2,0,0,0,0,2
Kec. Mariso Kota Makassar,7,1,0,0,0,8
Kec. Mamajang Kota Makassar,11,5,0,0,0,16
Kec. Tamalate Kota Makassar,8,4,0,0,0,12
Kec. Makasar Kota Makassar,8,2,0,0,0,10
Kec. Ujung Pandang Kota Makassar,11,3,0,0,0,14
Kec. Wajo Kota Makassar,4,0,0,0,0,4
Kec. Bontoala Kota Makassar,6,2,0,0,0,8
Kec. Ujung Tanah Kota Makassar,5,1,0,0,0,6
Kec. Tallo Kota Makassar,4,2,0,0,0,6
Kec. Panakukkang Kota Makassar,8,4,0,0,0,12
Kec. Biringkanaya Kota Makassar,13,3,0,0,0,16
Kec. Tamalanrea Kota Makassar,6,2,0,0,0,8
Kec. Rappocini Kota Makassar,6,4,0,0,0,10
Kec. Manggala Kota Makassar,12,3,0,0,0,15
Kec. Ujung Kota Parepare,3,3,0,0,0,6
Kec. Soreang Kota Parepare,1,1,0,0,0,2
Kec. Bacukiki Barat Kota Parepare,5,1,0,0,0,6
Kec. Wara Kota Palopo,4,0,0,0,0,4
Kec. Wara Utara Kota Palopo,6,0,0,0,0,6
Kec. Wara Selatan Kota Palopo,2,0,0,0,0,2
Kec. Wara Barat Kota Palopo,0,0,0,0,0,0
Kec. Sendana Kota Palopo,0,0,0,0,0,0
Kec. Bara Kota Palopo,6,0,0,0,0,6
Kec. Bonggakaradeng Kab. Tana Toraja,0,2,0,0,0,2
Kec. Mengkendek Kab. Tana Toraja,3,1,0,0,0,4
Kec. Sangalla Kab. Tana Toraja,2,0,0,0,0,2
Kec. Makale Kab. Tana Toraja,5,1,0,0,0,6
Kec. Saluputti Kab. Tana Toraja,0,0,0,0,0,0
Kec. Simbuang Kab. Tana Toraja,0,0,0,0,0,0
Kec. Rantetayo Kab. Tana Toraja,0,0,0,0,0,0
Kec. Bittuang Kab. Tana Toraja,0,0,0,0,0,0
Kec. Mappak Kab. Tana Toraja,0,0,0,0,0,0
Kec. Gandangbatu Sillanan Kab. Tana Toraja,2,2,0,0,0,4
Kec. Masanda Kab. Tana Toraja,1,1,0,0,0,2
Kec. Sabbang Kab. Luwu Utara,2,0,0,0,0,2
Kec. Baebunta Kab. Luwu Utara,0,2,0,0,0,2
Kec. Malangke Kab. Luwu Utara,2,2,0,0,0,4
Kec. Sukamaju Kab. Luwu Utara,0,0,0,0,0,0
Kec. Bone-Bone Kab. Luwu Utara,0,2,0,0,0,2
Kec. Masamba Kab. Luwu Utara,1,1,0,0,0,2
Kec. Rongkong Kab. Luwu Utara,0,0,0,0,0,0
Kec. Mappedeceng Kab. Luwu Utara,0,2,0,0,0,2
Kec. Seko Kab. Luwu Utara,0,0,0,0,0,0
Kec. Rampi Kab. Luwu Utara,0,0,0,0,0,0
Kec. Malangke Barat Kab. Luwu Utara,0,0,0,0,0,0
Kec. Tana Lili Kab. Luwu Utara,0,0,0,0,0,0
Kec. Baebunta Selatan Kab. Luwu Utara,2,0,0,0,0,2
Kec. Tinanggea Kab. Konawe Selatan,2,2,0,0,0,4
Kec. Palangga Kab. Konawe Selatan,2,0,0,0,0,2
Kec. Konda Kab. Konawe Selatan,2,0,0,0,0,2
Kec. Lainea Kab. Konawe Selatan,0,0,0,0,0,0
Kec. Moramo Kab. Konawe Selatan,3,1,0,0,0,4
Kec. Ranomeeto Kab. Konawe Selatan,0,0,0,0,0,0
Kec. Landono Kab. Konawe Selatan,0,0,0,0,0,0
Kec. Kolono Kab. Konawe Selatan,2,0,0,0,0,2
Kec. Andolo Kab. Konawe Selatan,0,0,0,0,0,0
Kec. Laonti Kab. Konawe Selatan,0,0,0,0,0,0
Kec. Angata Kab. Konawe Selatan,0,0,0,0,0,0
Kec. Lalembuu Kab. Konawe Selatan,0,1,0,0,0,1
Kec. Buke Kab. Konawe Selatan,0,0,0,0,0,0
Kec. Palangga Selatan Kab. Konawe Selatan,0,0,0,0,0,0
Kec. Baito Kab. Konawe Selatan,0,0,0,0,0,0
Kec. Laeya Kab. Konawe Selatan,8,0,0,0,0,8
Kec. Moramo Utara Kab. Konawe Selatan,0,0,0,0,0,0
Kec. Wolasi Kab. Konawe Selatan,0,0,0,0,0,0
Kec. Ranomeeto Barat Kab. Konawe Selatan,0,0,0,0,0,0
Kec. Basala Kab. Konawe Selatan,0,0,0,0,0,0
Kec. Langgikima Kab. Konawe Utara,2,0,0,0,0,2
Kec. Lembo Kab. Konawe Utara,0,0,0,0,0,0
Kec. Asera Kab. Konawe Utara,0,2,0,0,0,2
Kec. Wiwirano Kab. Konawe Utara,0,0,0,0,0,0
Kec. Lasolo Kab. Konawe Utara,0,2,0,0,0,2
Kec. Sawa Kab. Konawe Utara,4,0,0,0,0,4
Kec. Oheo Kab. Konawe Utara,0,0,0,0,0,0
Kec. Motui Kab. Konawe Utara,0,0,0,0,0,0
Kec. Landawe Kab. Konawe Utara,0,0,0,0,0,0
Kec. Lasolo Kepulauan Kab. Konawe Utara,0,0,0,0,0,0
Kec. Kulisusu Kab. Buton Utara,1,1,0,0,0,2
Kec. Kulisusu Barat Kab. Buton Utara,0,0,0,0,0,0
Kec. Kulisusu Utara Kab. Buton Utara,0,0,0,0,0,0
Kec. Kambowa Kab. Buton Utara,0,0,0,0,0,0
Kec. Bonegunu Kab. Buton Utara,0,0,0,0,0,0
Kec. Wakorumba Utara Kab. Buton Utara,0,0,0,0,0,0
KEC. LADONGI Kab. Kolaka Timur,3,1,0,0,0,4
KEC. POLI-POLIA Kab. Kolaka Timur,0,0,0,0,0,0
KEC. LAMBANDIA Kab. Kolaka Timur,2,0,0,0,0,2
Kec. Lalolae Kab. Kolaka Timur,0,0,0,0,0,0
KEC. MOWEWE Kab. Kolaka Timur,0,2,0,0,0,2
KEC. ULUIWOI Kab. Kolaka Timur,0,0,0,0,0,0
KEC. TINONDO Kab. Kolaka Timur,0,0,0,0,0,0
KEC. TIRAWUTA Kab. Kolaka Timur,3,1,0,0,0,4
Kec. Ueesi Kab. Kolaka Timur,0,0,0,0,0,0
Kec. Aere Kab. Kolaka Timur,0,0,0,0,0,0
Kec. Dangia Kab. Kolaka Timur,0,2,0,0,0,2
Kec. Tongkuno Kab. Muna,4,0,0,0,0,4
Kec. Parigi Kab. Muna,2,0,0,0,0,2
Kec. Kabawo Kab. Muna,1,1,0,0,0,2
Kec. Katobu Kab. Muna,3,2,0,0,0,5
Kec. Napabalano Kab. Muna,0,2,0,0,0,2
Kec. Wakorumba Selatan Kab. Muna,0,0,0,0,0,0
Kec. Lohia Kab. Muna,2,0,0,0,0,2
Kec. Kontunaga Kab. Muna,2,0,0,0,0,2
Kec. Kabangka Kab. Muna,1,1,0,0,0,2
Kec. Maligano Kab. Muna,0,0,0,0,0,0
Kec. Watopute Kab. Muna,0,0,0,0,0,0
Kec. Batalaiworu Kab. Muna,7,1,0,0,0,8
Kec. Duruka Kab. Muna,0,0,0,0,0,0
Kec. Lasalepa Kab. Muna,0,0,0,0,0,0
Kec. Pasir Putih Kab. Muna,0,0,0,0,0,0
Kec. Bone Kab. Muna,2,2,0,0,0,4
Kec. Kontu Kowuna Kab. Muna,2,0,0,0,0,2
Kec. Marobo Kab. Muna,0,0,0,0,0,0
Kec. Tongkuno Selatan Kab. Muna,1,1,0,0,0,2
Kec. Batukara Kab. Muna,0,2,0,0,0,2
Kec. Towea Kab. Muna,0,0,0,0,0,0
Kec. Lasalimu Kab. Buton,2,0,0,0,0,2
Kec. Pasar Wajo Kab. Buton,5,1,0,0,0,6
Kec. Kapontori Kab. Buton,0,0,0,0,0,0
Kec. Lasalimu Selatan Kab. Buton,2,0,0,0,0,2
Kec. Siontapia Kab. Buton,0,0,0,0,0,0
Kec. Wolowa Kab. Buton,0,0,0,0,0,0
Kec. Wabula Kab. Buton,2,0,0,0,0,2
Kec. Betoambari Kota Baubau,2,0,0,0,0,2
Kec. Wolio Kota Baubau,2,2,0,0,0,4
Kec. Sorawolio Kota Baubau,0,2,0,0,0,2
Kec. Bungi Kota Baubau,0,2,0,0,0,2
Kec. Murhum Kota Baubau,2,4,0,0,0,6
Kec. Lea-Lea Kota Baubau,2,0,0,0,0,2
Kec. Wawonii Barat Kab. Konawe Kepulauan,0,0,0,0,0,0
Kec. Wawonii Utara Kab. Konawe Kepulauan,0,0,0,0,0,0
Kec. Wawonii Timur Laut Kab. Konawe Kepulauan,0,0,0,0,0,0
Kec. Wawonii Timur Kab. Konawe Kepulauan,0,0,0,0,0,0
Kec. Wawonii Tenggara Kab. Konawe Kepulauan,0,0,0,0,0,0
Kec. Wawonii Tengah Kab. Konawe Kepulauan,2,0,0,0,0,2
Kec. Sawerigadi Kab. Muna Barat,0,0,0,0,0,0
Kec. Barangka Kab. Muna Barat,0,2,0,0,0,2
Kec. Lawa Kab. Muna Barat,1,1,0,0,0,2
Kec. Wadaga Kab. Muna Barat,0,0,0,0,0,0
Kec. Maginti Kab. Muna Barat,2,0,0,0,0,2
Kec. Tiworo Tengah Kab. Muna Barat,0,0,0,0,0,0
Kec. Tiworo Kepulauan Kab. Muna Barat,2,0,0,0,0,2
Kec. Napano Kusambi Kab. Muna Barat,0,0,0,0,0,0
Kec. Kusambi Kab. Muna Barat,0,2,0,0,0,2
Kec. Batauga Kab. Buton Selatan,2,0,0,0,0,2
Kec. Sampolawa Kab. Buton Selatan,6,0,0,0,0,6
Kec. Lapandewa Kab. Buton Selatan,2,0,0,0,0,2
Kec. Batu Atas Kab. Buton Selatan,0,0,0,0,0,0
Kec. Siompu Barat Kab. Buton Selatan,1,1,0,0,0,2
Kec. Siompu Kab. Buton Selatan,0,0,0,0,0,0
Kec. Kadatua Kab. Buton Selatan,0,0,0,0,0,0
Kec. Lakudo Kab. Buton Tengah,4,1,0,0,0,5
Kec. Mawasangka Timur Kab. Buton Tengah,2,0,0,0,0,2
Kec. Mawasangka Tengah Kab. Buton Tengah,3,1,0,0,0,4
Kec. Mawasangka Kab. Buton Tengah,5,1,0,0,0,6
Kec.Talaga Raya Kab. Buton Tengah,0,0,0,0,0,0
Kec. Gu Kab. Buton Tengah,0,2,0,0,0,2
Kec. Sangia Wambulu Kab. Buton Tengah,0,0,0,0,0,0
Kec. Mandonga Kota Kendari,1,3,0,0,0,4
Kec. Poasia Kota Kendari,0,4,0,0,0,4
Kec. Kendari Kota Kendari,1,3,0,0,0,4
Kec. Baruga Kota Kendari,4,2,0,0,0,6
Kec. Kendari Barat Kota Kendari,2,4,0,0,0,6
Kec. Abeli Kota Kendari,0,0,0,0,0,0
Kec. Puuwatu Kota Kendari,2,0,0,0,0,2
Kec. Kadia Kota Kendari,3,3,0,0,0,6
Kec. Wua-Wua Kota Kendari,2,0,0,0,0,2
Kec. Kambu Kota Kendari,4,0,0,0,0,4
Kec. Soropia Kab. Konawe,1,1,0,0,0,2
Kec. Sampara Kab. Konawe,2,0,0,0,0,2
Kec. Lambuya Kab. Konawe,1,1,0,0,0,2
Kec. Pondidaha Kab. Konawe,2,0,0,0,0,2
Kec. Wawotobi Kab. Konawe,1,1,0,0,0,2
Kec. Unaaha Kab. Konawe,6,2,0,0,0,8
Kec. Abuki Kab. Konawe,0,0,0,0,0,0
Kec. Bondoala Kab. Konawe,0,0,0,0,0,0
Kec. Uepai Kab. Konawe,0,0,0,0,0,0
Kec. Wonggeduku Kab. Konawe,0,0,0,0,0,0
Kec. Tongauna Kab. Konawe,2,0,0,0,0,2
Kec. Besulutu Kab. Konawe,0,0,0,0,0,0
Kec. Puriala Kab. Konawe,0,1,0,0,0,1
Kec. Meluhu Kab. Konawe,0,0,0,0,0,0
Kec. Amonggedo Kab. Konawe,0,0,0,0,0,0
Kec. Routa Kab. Konawe,0,0,0,0,0,0
Kec. Anggaberi Kab. Konawe,0,0,0,0,0,0
Kec. Kapoiala Kab. Konawe,0,0,0,0,0,0
Kec. Konawe Kab. Konawe,0,0,0,0,0,0
Kec. Asinua Kab. Konawe,0,0,0,0,0,0
Kec. Onembute Kab. Konawe,0,0,0,0,0,0
Kec. Morosi Kab. Konawe,0,0,0,0,0,0
Kec. Wonggeduku Barat Kab. Konawe,2,0,0,0,0,2
Kec. Binongko Kab. Wakatobi,0,0,0,0,0,0
Kec. Tomia Kab. Wakatobi,2,0,0,0,0,2
Kec. Kaledupa Kab. Wakatobi,1,1,0,0,0,2
Kec. Wangi-Wangi Kab. Wakatobi,1,1,0,0,0,2
Kec. Wangi-Wangi Selatan Kab. Wakatobi,0,2,0,0,0,2
Kec. Kaledupa Selatan Kab. Wakatobi,0,0,0,0,0,0
Kec. Tomia Timur Kab. Wakatobi,0,0,0,0,0,0
Kec. Togo Binongko Kab. Wakatobi,0,0,0,0,0,0
Kec. Kabaena Timur Kab. Bombana,0,0,0,0,0,0
Kec. Poleang Kab. Bombana,1,1,0,0,0,2
Kec. Poleang Timur Kab. Bombana,0,0,0,0,0,0
Kec. Rumbia Kab. Bombana,1,1,0,0,0,2
Kec. Rarowatu Kab. Bombana,0,0,0,0,0,0
Kec. Poleang Barat Kab. Bombana,0,0,0,0,0,0
Kec. Mataoleo Kab. Bombana,0,0,0,0,0,0
Kec. Rarowatu Utara Kab. Bombana,2,0,0,0,0,2
Kec. Poleang Utara Kab. Bombana,2,0,0,0,0,2
Kec. Poleang Selatan Kab. Bombana,0,0,0,0,0,0
Kec. Poleang Tenggara Kab. Bombana,0,0,0,0,0,0
Kec. Kabaena Barat Kab. Bombana,0,0,0,0,0,0
Kec. Kabaena Tengah Kab. Bombana,0,0,0,0,0,0
Kec. Kep. Masaloka Raya Kab. Bombana,0,0,0,0,0,0
Kec. Rumbia Tengah Kab. Bombana,0,1,0,0,0,1
Kec. Poleang Tengah Kab. Bombana,0,0,0,0,0,0
Kec. Tontonunu Kab. Bombana,0,0,0,0,0,0
Kec. Lantari Jaya Kab. Bombana,0,0,0,0,0,0
Kec. Mata Usu Kab. Bombana,0,0,0,0,0,0
Kec. Lasusua Kab. Kolaka Utara,1,1,0,0,0,2
Kec. Pakue Kab. Kolaka Utara,2,0,0,0,0,2
Kec. Batuputih Kab. Kolaka Utara,0,2,0,0,0,2
Kec. Kodeoha Kab. Kolaka Utara,3,0,0,0,0,3
Kec. Pakue Tengah Kab. Kolaka Utara,1,1,0,0,0,2
Kec. Porehu Kab. Kolaka Utara,0,0,0,0,0,0
Kec. Katoi Kab. Kolaka Utara,0,0,0,0,0,0
Kec. Tolala Kab. Kolaka Utara,0,0,0,0,0,0
Kec. Watubangga Kab. Kolaka,2,0,0,0,0,2
Kec. Pomalaa Kab. Kolaka,1,3,0,0,0,4
Kec. Wundulako Kab. Kolaka,2,0,0,0,0,2
Kec. Kolaka Kab. Kolaka,7,0,0,0,0,7
Kec. Wolo Kab. Kolaka,3,1,0,0,0,4
Kec. Tanggetada Kab. Kolaka,0,0,0,0,0,0
Kec. Latambaga Kab. Kolaka,2,0,0,0,0,2
Kec. Samaturu Kab. Kolaka,0,0,0,0,0,0
Kec. Toari Kab. Kolaka,0,0,0,0,0,0
Kec. Seram Timur Kab. Seram Bagian Timur,2,0,0,0,0,2
Kec. Werinama Kab. Seram Bagian Timur,0,0,0,0,0,0
Kec. Bula Kab. Seram Bagian Timur,0,2,0,0,0,2
Kec. Pulau Gorom Kab. Seram Bagian Timur,1,1,0,0,0,2
Kec. Wakate Kab. Seram Bagian Timur,4,0,0,0,0,4
Kec. Tutuk Tolu Kab. Seram Bagian Timur,0,0,0,0,0,0
Kec. Siwalalat Kab. Seram Bagian Timur,0,0,0,0,0,0
Kec. Kilmury Kab. Seram Bagian Timur,0,0,0,0,0,0
Kec. Pulau Panjang Kab. Seram Bagian Timur,0,0,0,0,0,0
Kec. Teor Kab. Seram Bagian Timur,0,0,0,0,0,0
Kec. Gorom Timur Kab. Seram Bagian Timur,0,0,0,0,0,0
Kec. Bula Barat Kab. Seram Bagian Timur,0,0,0,0,0,0
Kec. Kian Darat Kab. Seram Bagian Timur,0,0,0,0,0,0
Kec. Siritaun Wida Timur Kab. Seram Bagian Timur,0,0,0,0,0,0
Kec. Pulau-Pulau Aru Kab. Kepulauan Aru,2,2,0,0,0,4
Kec. Aru Tengah Kab. Kepulauan Aru,0,0,0,0,0,0
Kec. Aru Selatan Kab. Kepulauan Aru,0,0,0,0,0,0
Kec. Aru Tengah Timur Kab. Kepulauan Aru,0,0,0,0,0,0
Kec. Aru Tengah Selatan Kab. Kepulauan Aru,0,0,0,0,0,0
Kec. Aru Utara Kab. Kepulauan Aru,0,0,0,0,0,0
Kec. Aru Utara Timur Batuley Kab. Kepulauan Aru,0,0,0,0,0,0
Kec. Nusaniwe Kota Ambon,13,5,0,0,0,18
Kec. Sirimau Kota Ambon,15,7,0,0,0,22
Kec. Teluk Ambon  Kota Ambon,6,4,0,0,0,10
Kec. Baguala Kota Ambon,14,2,0,0,0,16
Kec. Lei Timur Selatan Kota Ambon,1,1,0,0,0,2
Kec. Pulau Dullah Selatan Kota Tual,6,2,0,0,0,8
Kec. Pulau Dullah Utara Kota Tual,0,0,0,0,0,0
Kec. Tayando Tam Kota Tual,0,0,0,0,0,0
Kec. Kur Selatan Kota Tual,0,0,0,0,0,0
Kec. Banda Kab. Maluku Tengah,1,3,0,0,0,4
Kec. Tehoru Kab. Maluku Tengah,2,0,0,0,0,2
Kec. Amahai Kab. Maluku Tengah,4,0,0,0,0,4
Kec. Teon Nila Serua Kab. Maluku Tengah,0,0,0,0,0,0
Kec. Saparua Kab. Maluku Tengah,8,2,0,0,0,10
Kec. Pulau Haruku Kab. Maluku Tengah,4,2,0,0,0,6
Kec. Salahutu Kab. Maluku Tengah,6,0,0,0,0,6
Kec. Leihitu Kab. Maluku Tengah,4,0,0,0,0,4
Kec. Seram Utara Kab. Maluku Tengah,0,0,0,0,0,0
Kec. Masohi Kab. Maluku Tengah,2,2,0,0,0,4
Kec. Nusa Laut Kab. Maluku Tengah,1,1,0,0,0,2
Kec. Teluk Elpaputih Kab. Maluku Tengah,1,1,0,0,0,2
Kec. Seram Utara Barat Kab. Maluku Tengah,0,2,0,0,0,2
Kec. Leihitu Barat Kab. Maluku Tengah,0,0,0,0,0,0
Kec. Telutih Kab. Maluku Tengah,0,0,0,0,0,0
Kec. Seram Utara Timur Seti Kab. Maluku Tengah,0,0,0,0,0,0
Kec. Seram Utara Timur Kobi Kab. Maluku Tengah,0,0,0,0,0,0
Kec. Saparua Timur Kab. Maluku Tengah,5,1,0,0,0,6
Kec. Kei Kecil Kab. Maluku Tenggara,9,5,0,0,0,14
Kec. Kei Besar Kab. Maluku Tenggara,0,0,0,0,0,0
Kec. Kei Besar Selatan Kab. Maluku Tenggara,0,0,0,0,0,0
Kec. Kei Besar Utara Timur Kab. Maluku Tenggara,0,0,0,0,0,0
Kec. Kei Kecil Barat Kab. Maluku Tenggara,0,0,0,0,0,0
Kec. Kei Kecil Timur Kab. Maluku Tenggara,0,0,0,0,0,0
Kec. Hoat Sorbay Kab. Maluku Tenggara,2,0,0,0,0,2
Kec. Kei Kecil Timur Selatan Kab. Maluku Tenggara,0,0,0,0,0,0
Kec. Babar Timur Kab. Maluku Barat Daya,0,0,0,0,0,0
Kec. Mdona Hiera Kab. Maluku Barat Daya,0,0,0,0,0,0
Kec. Moa Lakor Kab. Maluku Barat Daya,0,0,0,0,0,0
Kec. Pulau Letti Kab. Maluku Barat Daya,1,0,0,0,0,1
Kec. Wetar Kab. Maluku Barat Daya,0,0,0,0,0,0
Kec. Damer Kab. Maluku Barat Daya,6,0,0,0,0,6
Kec. Pulau-pulau Babar Kab. Maluku Barat Daya,1,1,0,0,0,2
Kec. Pulau-pulau Terselatan Kab. Maluku Barat Daya,2,2,0,0,0,4
Kec. Pulau Masela Kab. Maluku Barat Daya,0,0,0,0,0,0
Kec. Dawelor Dawera Kab. Maluku Barat Daya,0,0,0,0,0,0
Kec. Pulau Wetang Kab. Maluku Barat Daya,0,0,0,0,0,0
Kec. Pulau Lakor Kab. Maluku Barat Daya,0,0,0,0,0,0
Kec. Wetar Timur Kab. Maluku Barat Daya,0,0,0,0,0,0
Kec. Ambalau Kab. Buru Selatan,0,0,0,0,0,0
Kec. Kepala Madan Kab. Buru Selatan,0,0,0,0,0,0
Kec. Leksula Kab. Buru Selatan,1,1,0,0,0,2
Kec. Namrole Kab. Buru Selatan,1,1,0,0,0,2
Kec. Waesama Kab. Buru Selatan,0,2,0,0,0,2
Kec. Airbuaya Kab. Buru,0,0,0,0,0,0
Kec. Waeapo Kab. Buru,0,0,0,0,0,0
Kec. Namlea Kab. Buru,2,2,0,0,0,4
Kec. Waplau Kab. Buru,0,0,0,0,0,0
Kec. Batabual Kab. Buru,0,0,0,0,0,0
Kec. Lolong Guba Kab. Buru,0,0,0,0,0,0
Kec. Waelata Kab. Buru,0,0,0,0,0,0
Kec. Lilialy Kab. Buru,0,0,0,0,0,0
Kec. Tanimbar Selatan Kab. Kepulauan Tanimbar,1,3,0,0,0,4
Kec. Tanimbar Utara Kab. Kepulauan Tanimbar,2,0,0,0,0,2
Kec. Wer Tamrian Kab. Kepulauan Tanimbar,0,0,0,0,0,0
Kec. Wer Maktian Kab. Kepulauan Tanimbar,4,0,0,0,0,4
Kec. Selaru Kab. Kepulauan Tanimbar,1,1,0,0,0,2
Kec. Yaru Kab. Kepulauan Tanimbar,0,0,0,0,0,0
Kec. Wuar Labobar Kab. Kepulauan Tanimbar,0,0,0,0,0,0
Kec. Nirun Mas Kab. Kepulauan Tanimbar,0,0,0,0,0,0
Kec. Kormomolin Kab. Kepulauan Tanimbar,0,0,0,0,0,0
Kec. Molu Maru Kab. Kepulauan Tanimbar,0,0,0,0,0,0
Kec. Kairatu Kab. Seram Bagian Barat,1,1,0,0,0,2
Kec. Seram Barat Kab. Seram Bagian Barat,5,1,0,0,0,6
Kec. Taniwel Kab. Seram Bagian Barat,3,1,0,0,0,4
Kec. Huamual Kab. Seram Bagian Barat,0,0,0,0,0,0
Kec. Amalatu Kab. Seram Bagian Barat,1,0,0,0,0,1
Kec. Elpaputih Kab. Seram Bagian Barat,2,0,0,0,0,2
Kec. Taniwel Timur Kab. Seram Bagian Barat,0,0,0,0,0,0
Kec. Huamual Belakang Kab. Seram Bagian Barat,2,2,0,0,0,4
Kec. Kepulauan Manipa Kab. Seram Bagian Barat,1,1,0,0,0,2
Kec. Kairatu Barat Kab. Seram Bagian Barat,0,2,0,0,0,2
Kec. Gerokgak Kab. Buleleng,4,0,0,0,0,4
Kec. Seririt Kab. Buleleng,1,1,0,0,0,2
Kec. Busungbiu Kab. Buleleng,2,0,0,0,0,2
Kec. Banjar Kab. Buleleng,6,0,0,0,0,6
Kec. Sukasada Kab. Buleleng,4,0,0,0,0,4
Kec. Buleleng Kab. Buleleng,13,3,0,0,0,16
Kec. Sawan Kab. Buleleng,1,1,0,0,0,2
Kec. Kubutambahan Kab. Buleleng,6,0,0,0,0,6
Kec. Tejakula Kab. Buleleng,3,1,0,0,0,4
Kec. Melaya Kab. Jembrana,3,1,0,0,0,4
Kec. Negara Kab. Jembrana,6,2,0,0,0,8
Kec. Mendoyo Kab. Jembrana,4,0,0,0,0,4
Kec. Pekutatan Kab. Jembrana,0,0,0,0,0,0
Kec. Jembrana Kab. Jembrana,4,2,0,0,0,6
Kec. Selemadeg Kab. Tabanan,0,0,0,0,0,0
Kec. Kerambitan Kab. Tabanan,2,0,0,0,0,2
Kec. Tabanan Kab. Tabanan,6,0,0,0,0,6
Kec. Kediri Kab. Tabanan,3,1,0,0,0,4
Kec. Marga Kab. Tabanan,2,0,0,0,0,2
Kec. Baturiti Kab. Tabanan,1,1,0,0,0,2
Kec. Penebel Kab. Tabanan,2,0,0,0,0,2
Kec. Pupuan Kab. Tabanan,2,0,0,0,0,2
Kec. Kuta Selatan Kab. Badung,12,0,0,0,0,12
Kec. Kuta Kab. Badung,9,3,0,0,0,12
Kec. Kuta Utara Kab. Badung,9,1,0,0,0,10
Kec. Mengwi Kab. Badung,7,3,0,0,0,10
Kec. Abiansemal Kab. Badung,6,0,0,0,0,6
Kec. Petang Kab. Badung,1,1,0,0,0,2
Kec. Sukawati Kab. Gianyar,1,1,0,0,0,2
Kec. Blahbatuh Kab. Gianyar,4,0,0,0,0,4
Kec. Gianyar Kab. Gianyar,2,2,0,0,0,4
Kec. Tampaksiring Kab. Gianyar,2,2,0,0,0,4
Kec. Ubud Kab. Gianyar,5,1,0,0,0,6
Kec. Tegallalang Kab. Gianyar,1,1,0,0,0,2
Kec. Payangan Kab. Gianyar,2,0,0,0,0,2
Kec. Nusapenida Kab. Klungkung,4,0,0,0,0,4
Kec. Banjarangkan Kab. Klungkung,2,0,0,0,0,2
Kec. Klungkung Kab. Klungkung,9,3,0,0,0,12
Kec. Dawan Kab. Klungkung,2,0,0,0,0,2
Kec. Susut Kab. Bangli,1,1,0,0,0,2
Kec. Bangli Kab. Bangli,5,0,0,0,0,5
Kec. Tembuku Kab. Bangli,2,0,0,0,0,2
Kec. Kintamani Kab. Bangli,2,0,0,0,0,2
Kec. Rendang Kab. Karang Asem,1,1,0,0,0,2
Kec. Sidemen Kab. Karang Asem,0,2,0,0,0,2
Kec. Manggis Kab. Karang Asem,4,0,0,0,0,4
Kec. Karangasem Kab. Karang Asem,9,3,0,0,0,12
Kec. Abang Kab. Karang Asem,2,0,0,0,0,2
Kec. Bebandem Kab. Karang Asem,0,0,0,0,0,0
Kec. Selat Kab. Karang Asem,0,0,0,0,0,0
Kec. Kubu Kab. Karang Asem,2,0,0,0,0,2
Kec. Denpasar Selatan Kota Denpasar,26,3,0,0,0,29
Kec. Denpasar Timur Kota Denpasar,5,1,0,0,0,6
Kec. Denpasar Barat Kota Denpasar,12,0,0,0,0,12
Kec. Denpasar Utara Kota Denpasar,16,2,0,0,0,18
Kec. Lunyuk Kab. Sumbawa,0,2,0,0,0,2
Kec. Alas Kab. Sumbawa,4,0,0,0,0,4
Kec. Batulanteh Kab. Sumbawa,0,0,0,0,0,0
Kec. Sumbawa Kab. Sumbawa,12,6,0,0,0,18
Kec. Moyo Hulu Kab. Sumbawa,2,0,0,0,0,2
Kec. Ropang Kab. Sumbawa,2,0,0,0,0,2
Kec. Plampang Kab. Sumbawa,0,2,0,0,0,2
Kec. Empang Kab. Sumbawa,0,0,0,0,0,0
Kec. Labuhan Badas Kab. Sumbawa,2,0,0,0,0,2
Kec. Alas Barat Kab. Sumbawa,0,0,0,0,0,0
Kec. Labangka Kab. Sumbawa,1,1,0,0,0,2
Kec. Rhee Kab. Sumbawa,2,0,0,0,0,2
Kec. Moyo Utara Kab. Sumbawa,0,0,0,0,0,0
Kec. Maronge Kab. Sumbawa,0,0,0,0,0,0
Kec. Lenangguar Kab. Sumbawa,0,0,0,0,0,0
Kec. Orong Telu Kab. Sumbawa,0,0,0,0,0,0
Kec. Utan Kab. Sumbawa,2,0,0,0,0,2
Kec. Lape Kab. Sumbawa,0,2,0,0,0,2
Kec. Hu`u Kab. Dompu,0,0,0,0,0,0
Kec. Dompu Kab. Dompu,0,2,0,0,0,2
Kec. Woja Kab. Dompu,0,3,0,0,0,3
Kec. Kilo Kab. Dompu,3,1,0,0,0,4
Kec. Kempo Kab. Dompu,1,1,0,0,0,2
Kec. Pekat Kab. Dompu,0,0,0,0,0,0
Kec. Pajo Kab. Dompu,1,1,0,0,0,2
Kec. Manggelewa Kab. Dompu,5,0,0,0,0,5
Kec. Sekotong Kab. Lombok Barat,2,2,0,0,0,4
Kec. Gerung Kab. Lombok Barat,1,3,0,0,0,4
Kec. Labuapi Kab. Lombok Barat,1,3,0,0,0,4
Kec. Kediri Kab. Lombok Barat,0,0,0,0,0,0
Kec. Narmada Kab. Lombok Barat,5,3,0,0,0,8
Kec. Gunung Sari Kab. Lombok Barat,0,2,0,0,0,2
Kec. Kuripan Kab. Lombok Barat,3,1,0,0,0,4
Kec. Lembar Kab. Lombok Barat,0,2,0,0,0,2
Kec. Batu Layar Kab. Lombok Barat,0,0,0,0,0,0
Kec. Lingsar Kab. Lombok Barat,1,1,0,0,0,2
Kec. Praya Barat Kab. Lombok Tengah,2,0,0,0,0,2
Kec. Pujut Kab. Lombok Tengah,1,3,0,0,0,4
Kec. Praya Timur Kab. Lombok Tengah,2,0,0,0,0,2
Kec. Janapria Kab. Lombok Tengah,1,2,0,0,0,3
Kec. Kopang Kab. Lombok Tengah,3,1,0,0,0,4
Kec. Praya Kab. Lombok Tengah,13,8,0,0,0,21
Kec. Jonggat Kab. Lombok Tengah,4,4,0,0,0,8
Kec. Pringgarata Kab. Lombok Tengah,4,0,0,0,0,4
Kec. Batukliang Kab. Lombok Tengah,3,1,0,0,0,4
Kec. Batukliang Utara Kab. Lombok Tengah,0,2,0,0,0,2
Kec. Praya Barat Daya Kab. Lombok Tengah,0,0,0,0,0,0
Kec. Praya Tengah Kab. Lombok Tengah,0,2,0,0,0,2
Kec. Keruak Kab. Lombok Timur,0,0,0,0,0,0
Kec. Sakra Kab. Lombok Timur,0,2,0,0,0,2
Kec. Terara Kab. Lombok Timur,3,1,0,0,0,4
Kec. Sikur Kab. Lombok Timur,1,1,0,0,0,2
Kec. Masbagik Kab. Lombok Timur,4,0,0,0,0,4
Kec. Sukamulia Kab. Lombok Timur,1,1,0,0,0,2
Kec. Selong Kab. Lombok Timur,4,4,0,0,0,8
Kec. Pringgabaya Kab. Lombok Timur,1,1,0,0,0,2
Kec. Aikmel Kab. Lombok Timur,12,0,0,0,0,12
Kec. Sambelia Kab. Lombok Timur,0,0,0,0,0,0
Kec. Labuhan Haji Kab. Lombok Timur,3,1,0,0,0,4
Kec. Suralaga Kab. Lombok Timur,0,0,0,0,0,0
Kec. Sakra Timur Kab. Lombok Timur,0,1,0,0,0,1
Kec. Sakra Barat Kab. Lombok Timur,3,0,0,0,0,3
Kec. Jerowaru Kab. Lombok Timur,0,0,0,0,0,0
Kec. Pringgasela Kab. Lombok Timur,1,1,0,0,0,2
Kec. Montong Gading Kab. Lombok Timur,2,1,0,0,0,3
Kec. Wanasaba Kab. Lombok Timur,1,3,0,0,0,4
Kec. Sembalun Kab. Lombok Timur,0,0,0,0,0,0
Kec. Suela Kab. Lombok Timur,0,2,0,0,0,2
Kec. Monta Kab. Bima,3,1,0,0,0,4
Kec. Bolo Kab. Bima,5,4,0,0,0,9
Kec. Woha Kab. Bima,4,2,0,0,0,6
Kec. Belo Kab. Bima,0,0,0,0,0,0
Kec. Wawo Kab. Bima,1,1,0,0,0,2
Kec. Sape Kab. Bima,2,4,0,0,0,6
Kec. Wera Kab. Bima,0,0,0,0,0,0
Kec. Donggo Kab. Bima,0,0,0,0,0,0
Kec. Sanggar Kab. Bima,2,2,0,0,0,4
Kec. Lambu Kab. Bima,1,1,0,0,0,2
Kec. Tambora Kab. Bima,0,0,0,0,0,0
Kec. Ambalawi Kab. Bima,0,0,0,0,0,0
Kec. Mada pangga Kab. Bima,4,2,0,0,0,6
Kec. Langgudu Kab. Bima,2,2,0,0,0,4
Kec. Soromandi Kab. Bima,2,2,0,0,0,4
Kec. Parado Kab. Bima,0,0,0,0,0,0
Kec. Lambitu Kab. Bima,0,0,0,0,0,0
Kec. Palibelo Kab. Bima,2,0,0,0,0,2
Kec. Jereweh Kab. Sumbawa Barat,1,1,0,0,0,2
Kec. Taliwang Kab. Sumbawa Barat,2,1,0,0,0,3
Kec. Seteluk Kab. Sumbawa Barat,0,2,0,0,0,2
Kec. Brang Rea Kab. Sumbawa Barat,1,1,0,0,0,2
Kec. Sekongkang Kab. Sumbawa Barat,0,0,0,0,0,0
Kec. Maluk Kab. Sumbawa Barat,0,0,0,0,0,0
Kec. Poto Tano Kab. Sumbawa Barat,2,0,0,0,0,2
Kec. Tanjung Kab. Lombok Utara,1,1,0,0,0,2
Kec. Gangga Kab. Lombok Utara,2,0,0,0,0,2
Kec. Bayan Kab. Lombok Utara,0,0,0,0,0,0
Kec. Pemenang Kab. Lombok Utara,0,2,0,0,0,2
Kec. Kayangan Kab. Lombok Utara,2,1,0,0,0,3
Kec. Ampenan Kota Mataram,10,0,0,0,0,10
Kec. Mataram Kota Mataram,4,0,0,0,0,4
Kec. Cakranegara Kota Mataram,6,0,0,0,0,6
Kec. Sekarbela Kota Mataram,4,0,0,0,0,4
Kec. Selaparang Kota Mataram,11,5,0,0,0,16
Kec. Sandubaya Kota Mataram,9,1,0,0,0,10
Kec. RasanaE Barat Kota Bima,3,3,0,0,0,6
Kec. RasanaE Timur Kota Bima,0,0,0,0,0,0
Kec. Asakota Kota Bima,0,0,0,0,0,0
Kec. Raba Kota Bima,7,3,1,0,0,11
Kec. Mpunda Kota Bima,6,0,0,0,0,6
