Kecamatan,Toilet Guru P Baik,Toilet Guru P Rusak Ringan,Toilet Guru P Rusak Sedang,Toilet Guru P Rusak Berat,Toilet Guru P Rusak Total,Toilet Guru P Total
Kec. Kepulauan Seribu Utara Kab. Kepulauan Seribu,0,2,0,0,0,2
Kec. Tanah Abang Kota Jakarta Pusat,32,2,0,0,0,34
Kec. Menteng Kota Jakarta Pusat,9,1,0,0,0,10
Kec. Senen Kota Jakarta Pusat,11,3,0,0,0,14
Kec. Johar Baru Kota Jakarta Pusat,3,1,0,0,0,4
Kec. Cempaka Putih Kota Jakarta Pusat,15,3,0,0,0,18
Kec. Kemayoran Kota Jakarta Pusat,17,1,0,0,0,18
Kec. Sawah Besar Kota Jakarta Pusat,17,5,0,0,0,22
Kec. Gambir Kota Jakarta Pusat,12,2,0,0,0,14
Kec. Penjaringan Kota Jakarta Utara,47,3,0,0,0,50
Kec. Pademangan Kota Jakarta Utara,3,1,0,0,0,4
Kec. Tanjung Priok Kota Jakarta Utara,31,7,0,0,0,38
Kec. Koja Kota Jakarta Utara,15,3,0,0,0,18
Kec. Kelapa Gading Kota Jakarta Utara,38,4,0,0,0,42
Kec. Cilincing Kota Jakarta Utara,15,3,0,0,0,18
Kec. Kembangan Kota Jakarta Barat,26,5,0,0,0,31
Kec. Kebon Jeruk Kota Jakarta Barat,23,3,0,0,0,26
Kec. Palmerah Kota Jakarta Barat,8,2,0,0,0,10
Kec. Grogol Petamburan Kota Jakarta Barat,34,2,0,0,0,36
Kec. Tambora Kota Jakarta Barat,11,1,0,0,0,12
Kec. Taman Sari Kota Jakarta Barat,22,2,0,0,0,24
Kec. Cengkareng Kota Jakarta Barat,34,4,0,0,0,38
Kec. Kali Deres Kota Jakarta Barat,41,5,0,0,0,46
Kec. Jagakarsa Kota Jakarta Selatan,20,2,0,0,0,22
Kec. Pasar Minggu Kota Jakarta Selatan,16,2,0,0,0,18
Kec. Cilandak Kota Jakarta Selatan,22,4,0,0,0,26
Kec. Pesanggrahan Kota Jakarta Selatan,14,0,0,0,0,14
Kec. Kebayoran Lama Kota Jakarta Selatan,29,3,0,0,0,32
Kec. Kebayoran Baru Kota Jakarta Selatan,32,5,0,0,0,37
Kec. Mampang Prapatan Kota Jakarta Selatan,9,1,0,0,0,10
Kec. Pancoran Kota Jakarta Selatan,7,1,0,0,0,8
Kec. Tebet Kota Jakarta Selatan,21,1,0,0,0,22
Kec. Setia Budi Kota Jakarta Selatan,5,3,0,0,0,8
Kec. Pasar Rebo Kota Jakarta Timur,24,4,0,0,0,28
Kec. Ciracas Kota Jakarta Timur,20,2,0,0,0,22
Kec. Cipayung Kota Jakarta Timur,15,1,0,0,0,16
Kec. Makasar Kota Jakarta Timur,15,5,0,0,0,20
Kec. Kramat Jati Kota Jakarta Timur,18,4,0,0,0,22
Kec. Jatinegara Kota Jakarta Timur,17,3,0,0,0,20
Kec. Duren Sawit Kota Jakarta Timur,30,8,0,0,0,38
Kec. Cakung Kota Jakarta Timur,25,3,0,0,0,28
Kec. Pulo Gadung Kota Jakarta Timur,30,2,0,0,0,32
Kec. Matraman Kota Jakarta Timur,12,2,0,0,0,14
Kec. Jatinangor Kab. Sumedang,7,0,0,0,0,7
Kec. Cimanggung Kab. Sumedang,1,3,0,0,0,4
Kec. Tanjungsari Kab. Sumedang,6,0,0,0,0,6
Kec. Rancakalong Kab. Sumedang,1,1,0,0,0,2
Kec. Sumedang Selatan Kab. Sumedang,1,1,0,0,0,2
Kec. Sumedang Utara Kab. Sumedang,2,2,0,0,0,4
Kec. Situraja Kab. Sumedang,6,0,0,0,0,6
Kec. Darmaraja Kab. Sumedang,4,0,0,0,0,4
Kec. Tomo Kab. Sumedang,1,1,0,0,0,2
Kec. Conggeang Kab. Sumedang,2,0,0,0,0,2
Kec. Cimalaka Kab. Sumedang,1,3,0,0,0,4
Kec. Tanjungkerta Kab. Sumedang,1,1,0,0,0,2
Kec. Pamulihan Kab. Sumedang,0,0,0,0,0,0
Kec. Jatinunggal Kab. Sumedang,2,0,0,0,0,2
Kec. Bantarujeg Kab. Majalengka,6,0,0,0,0,6
Kec. Cikijing Kab. Majalengka,1,3,0,0,0,4
Kec. Talaga Kab. Majalengka,2,0,0,0,0,2
Kec. Maja Kab. Majalengka,0,0,0,0,0,0
Kec. Majalengka Kab. Majalengka,3,3,0,0,0,6
Kec. Sukahaji Kab. Majalengka,2,0,0,0,0,2
Kec. Rajagaluh Kab. Majalengka,5,1,0,0,0,6
Kec. Sindangwangi Kab. Majalengka,2,0,0,0,0,2
Kec. Leuwimunding Kab. Majalengka,2,0,0,0,0,2
Kec. Palasah Kab. Majalengka,2,0,0,0,0,2
Kec. Jatiwangi Kab. Majalengka,6,0,0,0,0,6
Kec. Dawuan Kab. Majalengka,0,0,0,0,0,0
Kec. Kadipaten Kab. Majalengka,2,0,0,0,0,2
Kec. Jatitujuh Kab. Majalengka,0,0,0,0,0,0
Kec. Ligung Kab. Majalengka,2,0,0,0,0,2
Kec. Sumberjaya Kab. Majalengka,2,0,0,0,0,2
Kec. Sindang Kab. Majalengka,2,0,0,0,0,2
Kec. Kasokandel Kab. Majalengka,4,0,0,0,0,4
Kec. Waled Kab. Cirebon,2,0,0,0,0,2
Kec. Ciledug Kab. Cirebon,4,0,0,0,0,4
Kec. Losari Kab. Cirebon,7,1,0,0,0,8
Kec. Babakan Kab. Cirebon,3,1,0,0,0,4
Kec. Karang Sembung Kab. Cirebon,0,0,0,0,0,0
Kec. Lemah Abang Kab. Cirebon,12,0,0,0,0,12
Kec. Astana Japura Kab. Cirebon,0,0,0,0,0,0
Kec. Beber Kab. Cirebon,6,2,0,0,0,8
Kec. Sumber Kab. Cirebon,4,0,0,0,0,4
Kec. Palimanan Kab. Cirebon,3,3,0,0,0,6
Kec. Plumbon Kab. Cirebon,1,1,0,0,0,2
Kec. Weru Kab. Cirebon,1,1,0,0,0,2
Kec. Kapetakan Kab. Cirebon,0,0,0,0,0,0
Kec. Klangenan Kab. Cirebon,0,0,0,0,0,0
Kec. Arjawinangun Kab. Cirebon,4,0,0,0,0,4
Kec. Ciwaringin Kab. Cirebon,1,1,0,0,0,2
Kec. Susukan Kab. Cirebon,1,1,0,0,0,2
Kec. Gegesik Kab. Cirebon,1,1,0,0,0,2
Kec. Pabedilan Kab. Cirebon,0,0,0,0,0,0
Kec. Dukupuntang Kab. Cirebon,1,2,0,0,0,3
Kec. Panguragan Kab. Cirebon,0,0,0,0,0,0
Kec. Kaliwedi Kab. Cirebon,0,0,0,0,0,0
Kec. Pangenan Kab. Cirebon,0,0,0,0,0,0
Kec. Kedawung Kab. Cirebon,5,1,0,0,0,6
Kec. Karangwareng Kab. Cirebon,2,0,0,0,0,2
Kec. Gunung Jati Kab. Cirebon,0,2,0,0,0,2
Kec. Tengah Tani Kab. Cirebon,1,1,0,0,0,2
Kec. Suranenggala Kab. Cirebon,4,0,0,0,0,4
Kec. Jamblang Kab. Cirebon,0,2,0,0,0,2
Kec. Kota Bogor Selatan Kota Bogor,13,3,0,0,0,16
Kec. Kota Bogor Timur Kota Bogor,11,1,0,0,0,12
Kec. Kota Bogor Utara Kota Bogor,13,0,0,0,0,13
Kec. Kota Bogor Tengah Kota Bogor,16,2,0,0,0,18
Kec. Kota Bogor Barat Kota Bogor,13,3,0,0,0,16
Kec. Tanah Sareal Kota Bogor,7,7,0,0,0,14
Kec. Baros Kota Sukabumi,0,0,0,0,0,0
Kec. Citamiang Kota Sukabumi,2,2,0,0,0,4
Kec. Warudoyong Kota Sukabumi,0,0,0,0,0,0
Kec. Gunung Puyuh Kota Sukabumi,7,1,0,0,0,8
Kec. Cikole Kota Sukabumi,15,3,0,0,0,18
Kec. Cibeureum Kota Sukabumi,1,1,0,0,0,2
Kec. Harjamukti Kota Cirebon,3,1,0,0,0,4
Kec. Lemahwungkuk Kota Cirebon,9,1,0,0,0,10
Kec. Kesambi Kota Cirebon,17,7,0,0,0,24
Kec. Kejaksan Kota Cirebon,9,3,0,0,0,12
Kec. Pondokgede Kota Bekasi,11,5,0,0,0,16
Kec. Jatiasih Kota Bekasi,15,6,0,0,0,21
Kec. Bantargebang Kota Bekasi,2,0,0,0,0,2
Kec. Bekasi Timur Kota Bekasi,13,11,0,0,0,24
Kec. Bekasi Selatan Kota Bekasi,27,3,0,0,0,30
Kec. Bekasi Barat Kota Bekasi,9,3,0,0,0,12
Kec. Bekasi Utara Kota Bekasi,17,3,0,0,0,20
Kec. Jati Sampurna Kota Bekasi,9,3,0,0,0,12
Kec. Medan Satria Kota Bekasi,12,6,0,0,0,18
Kec. Rawalumbu Kota Bekasi,11,5,0,0,0,16
Kec. Mustika Jaya Kota Bekasi,12,0,0,0,0,12
Kec. Pondok Melati Kota Bekasi,9,3,0,0,0,12
Kec. Sawangan Kota Depok,6,4,0,0,0,10
Kec. Pancoran Mas Kota Depok,16,7,0,0,0,23
Kec. Sukmajaya Kota Depok,13,3,0,0,0,16
Kec. Cimanggis Kota Depok,12,0,0,0,0,12
Kec. Beji Kota Depok,3,3,0,0,0,6
Kec. Limo Kota Depok,6,0,0,0,0,6
Kec. Cipayung Kota Depok,16,0,0,0,0,16
Kec. Cilodong Kota Depok,6,4,0,0,0,10
Kec. Cinere Kota Depok,4,0,0,0,0,4
Kec. Tapos Kota Depok,7,1,0,0,0,8
Kec. Bojongsari Kota Depok,6,2,0,0,0,8
Kec. Talegong Kab. Garut,2,0,0,0,0,2
Kec. Cisewu Kab. Garut,2,0,0,0,0,2
Kec. Bungbulang Kab. Garut,1,1,0,0,0,2
Kec. Pakenjeng Kab. Garut,2,0,0,0,0,2
Kec. Cikelet Kab. Garut,1,1,0,0,0,2
Kec. Pameungpeuk Kab. Garut,0,0,0,0,0,0
Kec. Cibalong Kab. Garut,1,1,0,0,0,2
Kec. Cisompet Kab. Garut,4,0,0,0,0,4
Kec. Peundeuy Kab. Garut,0,0,0,0,0,0
Kec. Singajaya Kab. Garut,4,0,0,0,0,4
Kec. Cikajang Kab. Garut,6,4,0,0,0,10
Kec. Banjarwangi Kab. Garut,0,0,0,0,0,0
Kec. Cilawu Kab. Garut,4,0,0,0,0,4
Kec. Bayongbong Kab. Garut,0,2,0,0,0,2
Kec. Cisurupan Kab. Garut,2,0,0,0,0,2
Kec. Samarang Kab. Garut,2,0,0,0,0,2
Kec. Garut Kota Kab. Garut,2,6,0,0,0,8
Kec. Karangpawitan Kab. Garut,2,2,0,0,0,4
Kec. Wanaraja Kab. Garut,0,0,0,0,0,0
Kec. Sukawening Kab. Garut,4,2,0,0,0,6
Kec. Banyuresmi Kab. Garut,2,2,0,0,0,4
Kec. Leles Kab. Garut,4,0,0,0,0,4
Kec. Leuwigoong Kab. Garut,1,1,0,0,0,2
Kec. Cibatu Kab. Garut,4,0,0,0,0,4
Kec. Cibiuk Kab. Garut,0,0,0,0,0,0
Kec. Kadungora Kab. Garut,4,4,0,0,0,8
Kec. Blubur Limbangan Kab. Garut,2,2,0,0,0,4
Kec. Selaawi Kab. Garut,0,0,0,0,0,0
Kec. Malangbong Kab. Garut,5,1,0,0,0,6
Kec. Mekarmukti Kab. Garut,0,0,0,0,0,0
Kec. Caringin Kab. Garut,0,0,0,0,0,0
Kec. Cihurip Kab. Garut,0,2,0,0,0,2
Kec. Sukaresmi Kab. Garut,0,0,0,0,0,0
Kec. Pasirwangi Kab. Garut,0,0,0,0,0,0
Kec. Karangtengah Kab. Garut,0,0,0,0,0,0
Kec. Kersamanah Kab. Garut,0,0,0,0,0,0
Kec. Tarogong Kaler Kab. Garut,2,2,0,0,0,4
Kec. Tarogong Kidul Kab. Garut,6,4,0,0,0,10
Kec. Cigedug Kab. Garut,0,0,0,0,0,0
Kec. Sucinaraja Kab. Garut,0,0,0,0,0,0
Kec. Haurgeulis Kab. Indramayu,1,1,0,0,0,2
Kec. Kroya Kab. Indramayu,2,0,0,0,0,2
Kec. Gabuswetan Kab. Indramayu,0,0,0,0,0,0
Kec. Lelea Kab. Indramayu,0,0,0,0,0,0
Kec. Bangodua Kab. Indramayu,0,0,0,0,0,0
Kec. Widasari Kab. Indramayu,0,0,0,0,0,0
Kec. Kertasemaya Kab. Indramayu,7,1,0,0,0,8
Kec. Krangkeng Kab. Indramayu,1,1,0,0,0,2
Kec. Karangampel Kab. Indramayu,5,1,0,0,0,6
Kec. Juntinyuat Kab. Indramayu,2,0,0,0,0,2
Kec. Sliyeg Kab. Indramayu,2,1,0,0,0,3
Kec. Jatibarang Kab. Indramayu,4,2,0,0,0,6
Kec. Balongan Kab. Indramayu,2,0,0,0,0,2
Kec. Indramayu Kab. Indramayu,6,4,0,0,0,10
Kec. Sindang Kab. Indramayu,3,1,0,0,0,4
Kec. Lohbener Kab. Indramayu,0,0,0,0,0,0
Kec. Losarang Kab. Indramayu,3,1,0,0,0,4
Kec. Kandanghaur Kab. Indramayu,6,2,0,0,0,8
Kec. Bongas Kab. Indramayu,2,0,0,0,0,2
Kec. Anjatan Kab. Indramayu,4,0,0,0,0,4
Kec. Sukra Kab. Indramayu,0,0,0,0,0,0
Kec. Arahan Kab. Indramayu,0,0,0,0,0,0
Kec. Cantigi Kab. Indramayu,2,0,0,0,0,2
Kec. Gantar Kab. Indramayu,0,0,0,0,0,0
Kec. Terisi Kab. Indramayu,1,1,0,0,0,2
Kec. Sukagumiwang Kab. Indramayu,2,0,0,0,0,2
Kec. Kedokan Bunder Kab. Indramayu,1,1,0,0,0,2
Kec. Pasekan Kab. Indramayu,1,0,0,0,0,1
Kec. Tukdana Kab. Indramayu,0,2,0,0,0,2
Kec. Patrol Kab. Indramayu,0,0,0,0,0,0
Kec. Sagalaherang Kab. Subang,2,0,0,0,0,2
Kec. Jalancagak Kab. Subang,5,1,0,0,0,6
Kec. Cisalak Kab. Subang,1,1,0,0,0,2
Kec. Tanjungsiang Kab. Subang,2,0,0,0,0,2
Kec. Cijambe Kab. Subang,0,2,0,0,0,2
Kec. Cibogo Kab. Subang,0,0,0,0,0,0
Kec. Subang Kab. Subang,9,5,0,0,0,14
Kec. Kalijati Kab. Subang,3,1,0,0,0,4
Kec. Cipeundeuy Kab. Subang,5,1,0,0,0,6
Kec. Pabuaran Kab. Subang,2,0,0,0,0,2
Kec. Patokbeusi Kab. Subang,1,1,0,0,0,2
Kec. Purwadadi Kab. Subang,4,2,0,0,0,6
Kec. Pagaden Kab. Subang,2,0,0,0,0,2
Kec. Compreng Kab. Subang,0,0,0,0,0,0
Kec. Binong Kab. Subang,2,0,0,0,0,2
Kec. Ciasem Kab. Subang,3,1,0,0,0,4
Kec. Pamanukan Kab. Subang,3,1,0,0,0,4
Kec. Pusakanagara Kab. Subang,1,1,0,0,0,2
Kec. Blanakan Kab. Subang,0,0,0,0,0,0
Kec. Serangpanjang Kab. Subang,0,0,0,0,0,0
Kec. Kasomalang Kab. Subang,0,0,0,0,0,0
Kec. Cimahi Selatan Kota Cimahi,11,1,0,0,0,12
Kec. Cimahi Tengah Kota Cimahi,20,1,0,0,0,21
Kec. Cimahi Utara Kota Cimahi,11,1,0,0,0,12
Kec. Cibeureum Kota Tasikmalaya,4,0,0,0,0,4
Kec. Tamansari Kota Tasikmalaya,3,1,0,0,0,4
Kec. Kawalu Kota Tasikmalaya,4,2,0,0,0,6
Kec. Mangkubumi Kota Tasikmalaya,1,0,0,0,0,1
Kec. Indihiang Kota Tasikmalaya,10,2,0,0,0,12
Kec. Cipedes Kota Tasikmalaya,2,0,0,0,0,2
Kec. Cihideung Kota Tasikmalaya,4,2,0,0,0,6
Kec. Tawang Kota Tasikmalaya,17,3,0,0,0,20
Kec. Purbaratu Kota Tasikmalaya,2,0,0,0,0,2
Kec. Bungursari Kota Tasikmalaya,8,0,0,0,0,8
Kec. Banjar Kota Banjar,4,2,0,0,0,6
Kec. Langensari Kota Banjar,3,1,0,0,0,4
Kec. Nanggung Kab. Bogor,1,1,0,0,0,2
Kec. Leuwiliang Kab. Bogor,6,4,0,0,0,10
Kec. Pamijahan Kab. Bogor,3,1,0,0,0,4
Kec. Cibungbulang Kab. Bogor,2,2,0,0,0,4
Kec. Ciampea Kab. Bogor,3,3,0,0,0,6
Kec. Dramaga Kab. Bogor,3,1,0,0,0,4
Kec. Ciomas Kab. Bogor,1,1,0,0,0,2
Kec. Cijeruk Kab. Bogor,0,0,0,0,0,0
Kec. Caringin Kab. Bogor,2,0,0,0,0,2
Kec. Ciawi Kab. Bogor,5,2,0,0,0,7
Kec. Cisarua Kab. Bogor,4,0,0,0,0,4
Kec. Megamendung Kab. Bogor,2,2,0,0,0,4
Kec. Sukaraja Kab. Bogor,4,0,0,0,0,4
Kec. Babakan Madang Kab. Bogor,8,6,0,0,0,14
Kec. Sukamakmur Kab. Bogor,3,3,0,0,0,6
Kec. Cariu Kab. Bogor,1,1,0,0,0,2
Kec. Jonggol Kab. Bogor,10,0,0,0,0,10
Kec. Cileungsi Kab. Bogor,8,4,0,0,0,12
Kec. Gunungputri Kab. Bogor,34,2,0,0,0,36
Kec. Citeureup Kab. Bogor,1,1,0,0,0,2
Kec. Cibinong Kab. Bogor,25,3,0,0,0,28
Kec. Bojong Gede Kab. Bogor,0,0,0,0,0,0
Kec. Kemang Kab. Bogor,9,3,0,0,0,12
Kec. Parung Kab. Bogor,6,2,0,0,0,8
Kec. Gunung Sindur Kab. Bogor,12,0,0,0,0,12
Kec. Rumpin Kab. Bogor,3,3,0,0,0,6
Kec. Cigudeg Kab. Bogor,2,0,0,0,0,2
Kec. Jasinga Kab. Bogor,2,0,0,0,0,2
Kec. Tenjo Kab. Bogor,2,2,0,0,0,4
Kec. Parungpanjang Kab. Bogor,3,1,0,0,0,4
Kec. Tamansari Kab. Bogor,4,2,0,0,0,6
Kec. Ciseeng Kab. Bogor,6,2,0,0,0,8
Kec. Klapanunggal Kab. Bogor,1,1,0,0,0,2
Kec. Sukajaya Kab. Bogor,2,0,0,0,0,2
Kec. Ranca Bungur Kab. Bogor,6,0,0,0,0,6
Kec. Tanjung Sari Kab. Bogor,0,0,0,0,0,0
Kec. Tajurhalang Kab. Bogor,3,3,0,0,0,6
Kec. Cigombong Kab. Bogor,8,0,0,0,0,8
Kec. Leuwisadeng Kab. Bogor,2,0,0,0,0,2
Kec. Tenjolaya Kab. Bogor,2,2,0,0,0,4
Kec. Ciwidey Kab. Bandung,3,1,0,0,0,4
Kec. Pasirjambu Kab. Bandung,0,2,0,0,0,2
Kec. Cimaung Kab. Bandung,2,0,0,0,0,2
Kec. Pangalengan Kab. Bandung,2,0,0,0,0,2
Kec. Kertasari Kab. Bandung,1,1,0,0,0,2
Kec. Pacet Kab. Bandung,0,0,0,0,0,0
Kec. Ibun Kab. Bandung,1,1,0,0,0,2
Kec. Paseh Kab. Bandung,3,3,0,0,0,6
Kec. Cikancung Kab. Bandung,0,0,0,0,0,0
Kec. Cicalengka Kab. Bandung,5,1,0,0,0,6
Kec. Rancaekek Kab. Bandung,5,1,0,0,0,6
Kec. Majalaya Kab. Bandung,3,1,0,0,0,4
Kec. Ciparay Kab. Bandung,14,0,0,0,0,14
Kec. Baleendah Kab. Bandung,6,6,0,0,0,12
Kec. Arjasari Kab. Bandung,8,0,0,0,0,8
Kec. Banjaran Kab. Bandung,11,3,0,0,0,14
Kec. Pameungpeuk Kab. Bandung,0,0,0,0,0,0
Kec. Katapang Kab. Bandung,1,1,0,0,0,2
Kec. Soreang Kab. Bandung,10,0,0,0,0,10
Kec. Margaasih Kab. Bandung,5,1,0,0,0,6
Kec. Margahayu Kab. Bandung,9,4,0,0,0,13
Kec. Dayeuhkolot Kab. Bandung,6,0,0,0,0,6
Kec. Bojongsoang Kab. Bandung,2,0,0,0,0,2
Kec. Cileunyi Kab. Bandung,4,2,0,0,0,6
Kec. Cilengkrang Kab. Bandung,0,0,0,0,0,0
Kec. Cimenyan Kab. Bandung,2,0,0,0,0,2
Kec. Rancabali Kab. Bandung,2,0,0,0,0,2
Kec. Nagreg Kab. Bandung,2,0,0,0,0,2
Kec. Solokanjeruk Kab. Bandung,1,1,0,0,0,2
Kec. Cangkuang Kab. Bandung,5,1,0,0,0,6
Kec. Kutawaringin Kab. Bandung,0,2,0,0,0,2
Kec. Darma Kab. Kuningan,1,1,0,0,0,2
Kec. Kadugede Kab. Kuningan,2,0,0,0,0,2
Kec. Ciniru Kab. Kuningan,0,0,0,0,0,0
Kec. Subang Kab. Kuningan,0,1,0,0,0,1
Kec. Ciwaru Kab. Kuningan,1,1,0,0,0,2
Kec. Cibingbin Kab. Kuningan,1,1,0,0,0,2
Kec. Luragung Kab. Kuningan,2,0,0,0,0,2
Kec. Cidahu Kab. Kuningan,2,0,0,0,0,2
Kec. Ciawigebang Kab. Kuningan,0,0,0,0,0,0
Kec. Lebakwangi Kab. Kuningan,2,0,0,0,0,2
Kec. Garawangi Kab. Kuningan,3,1,0,0,0,4
Kec. Kuningan Kab. Kuningan,6,0,0,0,0,6
Kec. Cigugur Kab. Kuningan,4,0,0,0,0,4
Kec. Jalaksana Kab. Kuningan,6,0,0,0,0,6
Kec. Cilimus Kab. Kuningan,4,0,0,0,0,4
Kec. Mandirancan Kab. Kuningan,2,0,0,0,0,2
Kec. Pasawahan Kab. Kuningan,2,0,0,0,0,2
Kec. Pancalang Kab. Kuningan,2,0,0,0,0,2
Kec. Cigandamekar Kab. Kuningan,5,1,0,0,0,6
Kec. Rongga Kab. Bandung Barat,0,0,0,0,0,0
Kec. Gununghalu Kab. Bandung Barat,0,0,0,0,0,0
Kec. Sindangkerta Kab. Bandung Barat,7,3,0,0,0,10
Kec. Cililin Kab. Bandung Barat,9,3,0,0,0,12
Kec. Cihampelas Kab. Bandung Barat,6,0,0,0,0,6
Kec. Cipongkor Kab. Bandung Barat,0,0,0,0,0,0
Kec. Batujajar Kab. Bandung Barat,4,0,0,0,0,4
Kec. Cipatat Kab. Bandung Barat,0,2,0,0,0,2
Kec. Padalarang Kab. Bandung Barat,10,0,0,0,0,10
Kec. Ngamprah Kab. Bandung Barat,6,2,0,0,0,8
Kec. Parongpong Kab. Bandung Barat,14,2,0,0,0,16
Kec. Lembang Kab. Bandung Barat,9,5,0,0,0,14
Kec. Cisarua Kab. Bandung Barat,3,1,0,0,0,4
Kec. Cikalongwetan Kab. Bandung Barat,3,1,0,0,0,4
Kec. Cipeundeuy Kab. Bandung Barat,7,1,0,0,0,8
Kec. Saguling Kab. Bandung Barat,2,0,0,0,0,2
KEC. CIMERAK Kab. Pangandaran,0,0,0,0,0,0
KEC. CIGUGUR Kab. Pangandaran,0,0,0,0,0,0
KEC. LANGKAPLANCAR Kab. Pangandaran,0,0,0,0,0,0
KEC. MANGUNJAYA Kab. Pangandaran,0,0,0,0,0,0
KEC. PADAHERANG Kab. Pangandaran,0,4,0,0,0,4
KEC. PANGANDARAN Kab. Pangandaran,2,2,0,0,0,4
KEC. PARIGI Kab. Pangandaran,2,0,0,0,0,2
Kec. Bandung Kulon Kota Bandung,2,4,0,0,0,6
Kec. Babakan Ciparay Kota Bandung,1,1,0,0,0,2
Kec. Bojong Loa Kaler Kota Bandung,10,0,0,0,0,10
Kec. Bojong Loa Kidul Kota Bandung,6,2,0,0,0,8
Kec. Astanaanyar Kota Bandung,4,0,0,0,0,4
Kec. Regol Kota Bandung,9,1,0,0,0,10
Kec. Lengkong Kota Bandung,14,8,0,0,0,22
Kec. Bandung Kidul Kota Bandung,2,0,0,0,0,2
Kec. Buahbatu Kota Bandung,4,2,0,0,0,6
Kec. Rancasari Kota Bandung,2,0,0,0,0,2
Kec. Cibiru Kota Bandung,4,4,0,0,0,8
Kec. Ujungberung Kota Bandung,4,2,0,0,0,6
Kec. Arcamanik Kota Bandung,6,0,0,0,0,6
Kec. Kiaracondong Kota Bandung,11,3,0,0,0,14
Kec. Sumur Bandung Kota Bandung,9,1,0,0,0,10
Kec. Andir Kota Bandung,21,7,0,0,0,28
Kec. Cicendo Kota Bandung,12,8,0,0,0,20
Kec. Bandung Wetan Kota Bandung,14,0,0,0,0,14
Kec. Cibeunying Kidul Kota Bandung,6,2,0,0,0,8
Kec. Cibeunying Kaler Kota Bandung,7,1,0,0,0,8
Kec. Coblong Kota Bandung,20,4,0,0,0,24
Kec. Sukajadi Kota Bandung,3,1,0,0,0,4
Kec. Sukasari Kota Bandung,8,0,0,0,0,8
Kec. Cidadap Kota Bandung,6,2,0,0,0,8
Kec. Gedebage Kota Bandung,1,1,0,0,0,2
Kec. Panyileukan Kota Bandung,1,3,0,0,0,4
Kec. Mandalajati Kota Bandung,2,2,0,0,0,4
Kec. Antapani Kota Bandung,1,1,0,0,0,2
Kec. Ciemas Kab. Sukabumi,0,0,0,0,0,0
Kec. Ciracap Kab. Sukabumi,0,0,0,0,0,0
Kec. Surade Kab. Sukabumi,0,0,0,0,0,0
Kec. Jampang Kulon Kab. Sukabumi,1,3,0,0,0,4
Kec. Kalibunder Kab. Sukabumi,0,0,0,0,0,0
Kec. Tegalbuleud Kab. Sukabumi,0,0,0,0,0,0
Kec. Cidolog Kab. Sukabumi,0,0,0,0,0,0
Kec. Sagaranten Kab. Sukabumi,1,1,0,0,0,2
Kec. Lengkong Kab. Sukabumi,0,0,0,0,0,0
Kec. Pelabuhan Ratu Kab. Sukabumi,2,6,0,0,0,8
Kec. Warung Kiara Kab. Sukabumi,0,0,0,0,0,0
Kec. Jampang Tengah Kab. Sukabumi,3,0,0,0,0,3
Kec. Cikembar Kab. Sukabumi,2,0,0,0,0,2
Kec. Nyalindung Kab. Sukabumi,0,2,0,0,0,2
Kec. Sukaraja Kab. Sukabumi,0,2,0,0,0,2
Kec. Sukabumi Kab. Sukabumi,0,0,0,0,0,0
Kec. Kadudampit Kab. Sukabumi,2,0,0,0,0,2
Kec. Cisaat Kab. Sukabumi,4,2,0,0,0,6
Kec. Cibadak Kab. Sukabumi,8,0,0,0,0,8
Kec. Nagrak Kab. Sukabumi,0,0,0,0,0,0
Kec. Cicurug Kab. Sukabumi,8,0,0,0,0,8
Kec. Cidahu Kab. Sukabumi,1,1,0,0,0,2
Kec. Parakansalak Kab. Sukabumi,3,1,0,0,0,4
Kec. Parungkuda Kab. Sukabumi,5,1,0,0,0,6
Kec. Kalapa Nunggal Kab. Sukabumi,0,2,0,0,0,2
Kec. Cikidang Kab. Sukabumi,3,1,0,0,0,4
Kec. Cisolok Kab. Sukabumi,3,1,0,0,0,4
Kec. Kabandungan Kab. Sukabumi,2,0,0,0,0,2
Kec. Gunung Guruh Kab. Sukabumi,4,0,0,0,0,4
Kec. Cikakak Kab. Sukabumi,1,1,0,0,0,2
Kec. Bantar Gadung Kab. Sukabumi,4,0,0,0,0,4
Kec. Cicantayan Kab. Sukabumi,6,0,0,0,0,6
Kec. Simpenan Kab. Sukabumi,5,1,0,0,0,6
Kec. Curugkembar Kab. Sukabumi,0,0,0,0,0,0
Kec. Purabaya Kab. Sukabumi,0,0,0,0,0,0
Kec. Cireunghas Kab. Sukabumi,0,0,0,0,0,0
Kec. Sukalarang Kab. Sukabumi,1,1,0,0,0,2
Kec. Caringin Kab. Sukabumi,2,0,0,0,0,2
Kec. Bojong Genteng Kab. Sukabumi,7,3,0,0,0,10
Kec. Ciambar Kab. Sukabumi,0,0,0,0,0,0
Kec. Cipatujah Kab. Tasikmalaya,0,0,0,0,0,0
Kec. Karangnunggal Kab. Tasikmalaya,1,0,0,0,0,1
Kec. Cikalong Kab. Tasikmalaya,1,1,0,0,0,2
Kec. Pancatengah Kab. Tasikmalaya,0,0,0,0,0,0
Kec. Cikatomas Kab. Tasikmalaya,0,2,0,0,0,2
Kec. Cibalong Kab. Tasikmalaya,0,2,0,0,0,2
Kec. Bantarkalong Kab. Tasikmalaya,2,0,0,0,0,2
Kec. Bojonggambir Kab. Tasikmalaya,0,0,0,0,0,0
Kec. Sodonghilir Kab. Tasikmalaya,1,1,0,0,0,2
Kec. Taraju Kab. Tasikmalaya,2,0,0,0,0,2
Kec. Salawu Kab. Tasikmalaya,7,3,0,0,0,10
Kec. Tanjungjaya Kab. Tasikmalaya,0,0,0,0,0,0
Kec. Sukaraja Kab. Tasikmalaya,0,0,0,0,0,0
Kec. Salopa Kab. Tasikmalaya,3,1,0,0,0,4
Kec. Cineam Kab. Tasikmalaya,0,0,0,0,0,0
Kec. Manonjaya Kab. Tasikmalaya,1,1,0,0,0,2
Kec. Singaparna Kab. Tasikmalaya,12,4,0,0,0,16
Kec. Cigalontang Kab. Tasikmalaya,1,1,0,0,0,2
Kec. Leuwisari Kab. Tasikmalaya,0,0,0,0,0,0
Kec. Cisayong Kab. Tasikmalaya,0,0,0,0,0,0
Kec. Rajapolah Kab. Tasikmalaya,2,2,0,0,0,4
Kec. Jamanis Kab. Tasikmalaya,0,0,0,0,0,0
Kec. Ciawi Kab. Tasikmalaya,0,2,0,0,0,2
Kec. Pagerageung Kab. Tasikmalaya,2,0,0,0,0,2
Kec. Sariwangi Kab. Tasikmalaya,1,1,0,0,0,2
Kec. Sukaratu Kab. Tasikmalaya,1,1,0,0,0,2
Kec. Sukarame Kab. Tasikmalaya,2,0,0,0,0,2
Kec. Bojongasih Kab. Tasikmalaya,0,0,0,0,0,0
Kec. Puspahiang Kab. Tasikmalaya,0,0,0,0,0,0
Kec. Jatiwaras Kab. Tasikmalaya,2,0,0,0,0,2
Kec. Mangunreja Kab. Tasikmalaya,1,1,0,0,0,2
Kec. Gunungtanjung Kab. Tasikmalaya,0,0,0,0,0,0
Kec. Padakembang Kab. Tasikmalaya,2,0,0,0,0,2
Kec. Sukahening Kab. Tasikmalaya,3,1,0,0,0,4
Kec. Jatiluhur Kab. Purwakarta,3,1,0,0,0,4
Kec. Maniis Kab. Purwakarta,2,0,0,0,0,2
Kec. Tegalwaru Kab. Purwakarta,0,0,0,0,0,0
Kec. Plered Kab. Purwakarta,2,0,0,0,0,2
Kec. Sukatani Kab. Purwakarta,0,2,0,0,0,2
Kec. Darangdan Kab. Purwakarta,0,0,2,0,0,2
Kec. Wanayasa Kab. Purwakarta,3,1,0,0,0,4
Kec. Pasawahan Kab. Purwakarta,3,0,0,0,0,3
Kec. Purwakarta Kab. Purwakarta,9,5,0,0,0,14
Kec. Campaka Kab. Purwakarta,1,1,0,0,0,2
Kec. Sukasari Kab. Purwakarta,0,0,0,0,0,0
Kec. Babakancikao Kab. Purwakarta,0,0,0,0,0,0
Kec. Cibatu Kab. Purwakarta,2,0,0,0,0,2
Kec. Bungursari Kab. Purwakarta,2,0,0,0,0,2
Kec. Pangkalan Kab. Karawang,2,0,0,0,0,2
Kec. Ciampel Kab. Karawang,4,0,0,0,0,4
Kec. Klari Kab. Karawang,0,2,0,0,0,2
Kec. Cikampek Kab. Karawang,3,1,0,0,0,4
Kec. Tirtamulya Kab. Karawang,0,0,0,0,0,0
Kec. Jatisari Kab. Karawang,1,3,0,0,0,4
Kec. Lemahabang Kab. Karawang,1,1,0,0,0,2
Kec. Telagasari Kab. Karawang,2,0,0,0,0,2
Kec. Rawamerta Kab. Karawang,2,0,0,0,0,2
Kec. Tempuran Kab. Karawang,2,0,0,0,0,2
Kec. Kutawaluya Kab. Karawang,1,1,0,0,0,2
Kec. Pedes Kab. Karawang,0,0,0,0,0,0
Kec. Cibuaya Kab. Karawang,0,0,0,0,0,0
Kec. Tirtajaya Kab. Karawang,0,0,0,0,0,0
Kec. Batujaya Kab. Karawang,4,0,0,0,0,4
Kec. Pakisjaya Kab. Karawang,0,0,0,0,0,0
Kec. Majalaya Kab. Karawang,0,2,0,0,0,2
Kec. Jayakerta Kab. Karawang,1,1,0,0,0,2
Kec. Banyusari Kab. Karawang,2,0,0,0,0,2
Kec. Kotabaru Kab. Karawang,3,1,0,0,0,4
Kec. Cilamaya Wetan Kab. Karawang,2,0,0,0,0,2
Kec. Teluk Jambe Barat Kab. Karawang,2,0,0,0,0,2
Kec. Teluk Jambe Timur Kab. Karawang,5,3,0,0,0,8
Kec. Karawang Timur Kab. Karawang,4,2,0,0,0,6
Kec. Tegalwaru Kab. Karawang,0,0,0,0,0,0
Kec. Karawang Barat Kab. Karawang,17,2,0,0,0,19
Kec. Agrabinta Kab. Cianjur,0,0,0,0,0,0
Kec. Sindang Barang Kab. Cianjur,2,0,0,0,0,2
Kec. Cidaun Kab. Cianjur,3,1,0,0,0,4
Kec. Naringgul Kab. Cianjur,2,0,0,0,0,2
Kec. Cibinong Kab. Cianjur,5,1,0,0,0,6
Kec. Kadupandak Kab. Cianjur,0,0,0,0,0,0
Kec. Takokak Kab. Cianjur,1,1,0,0,0,2
Kec. Sukanagara Kab. Cianjur,1,1,0,0,0,2
Kec. Pagelaran Kab. Cianjur,2,0,0,0,0,2
Kec. Cibeber Kab. Cianjur,1,1,0,0,0,2
Kec. Cilaku Kab. Cianjur,7,1,0,0,0,8
Kec. Sukaluyu Kab. Cianjur,2,0,0,0,0,2
Kec. Ciranjang Kab. Cianjur,9,1,0,0,0,10
Kec. Mande Kab. Cianjur,1,1,0,0,0,2
Kec. Karang Tengah Kab. Cianjur,4,2,0,0,0,6
Kec. Cianjur Kab. Cianjur,16,6,0,0,0,22
Kec. Cugenang Kab. Cianjur,3,1,0,0,0,4
Kec. Pacet Kab. Cianjur,6,2,0,0,0,8
Kec. Sukaresmi Kab. Cianjur,4,0,0,0,0,4
Kec. Cikalong Kulon Kab. Cianjur,3,1,0,0,0,4
Kec. Bojong Picung Kab. Cianjur,0,0,0,0,0,0
Kec. Cikadu Kab. Cianjur,0,0,0,0,0,0
Kec. Leles Kab. Cianjur,2,0,0,0,0,2
Kec. Cijati Kab. Cianjur,0,0,0,0,0,0
Kec. Gekbrong Kab. Cianjur,4,0,0,0,0,4
Kec. Cipanas Kab. Cianjur,5,1,0,0,0,6
Kec. Haurwangi Kab. Cianjur,0,0,0,0,0,0
Kec. Pasirkuda Kab. Cianjur,0,0,0,0,0,0
Kec. Banjarsari Kab. Ciamis,7,3,0,0,0,10
Kec. Lakbok Kab. Ciamis,2,0,0,0,0,2
Kec. Pamarican Kab. Ciamis,4,0,0,0,0,4
Kec. Cimaragas Kab. Ciamis,0,0,0,0,0,0
Kec. Cijeungjing Kab. Ciamis,1,1,0,0,0,2
Kec. Cisaga Kab. Ciamis,2,0,0,0,0,2
Kec. Rancah Kab. Ciamis,6,0,0,0,0,6
Kec. Rajadesa Kab. Ciamis,4,0,0,0,0,4
Kec. Sukadana Kab. Ciamis,1,1,0,0,0,2
Kec. Ciamis Kab. Ciamis,5,4,0,0,0,9
Kec. Cikoneng Kab. Ciamis,0,2,0,0,0,2
Kec. Cihaurbeuti Kab. Ciamis,0,2,0,0,0,2
Kec. Cipaku Kab. Ciamis,1,1,0,0,0,2
Kec. Jatinagara Kab. Ciamis,0,0,0,0,0,0
Kec. Panawangan Kab. Ciamis,4,0,0,0,0,4
Kec. Kawali Kab. Ciamis,1,1,0,0,0,2
Kec. Panjalu Kab. Ciamis,0,0,0,0,0,0
Kec. Sindangkasih Kab. Ciamis,2,0,0,0,0,2
Kec. Baregbeg Kab. Ciamis,2,0,0,0,0,2
Kec. Lumbung Kab. Ciamis,0,0,0,0,0,0
Kec. Setu Kab. Bekasi,2,2,0,0,0,4
Kec. Cibarusah Kab. Bekasi,11,1,0,0,0,12
Kec. Kedung Waringin Kab. Bekasi,4,0,0,0,0,4
Kec. Cibitung Kab. Bekasi,2,0,0,0,0,2
Kec. Babelan Kab. Bekasi,4,0,0,0,0,4
Kec. Taruma Jaya Kab. Bekasi,6,0,0,0,0,6
Kec. Tambelang Kab. Bekasi,1,1,0,0,0,2
Kec. Sukatani Kab. Bekasi,4,2,0,0,0,6
Kec. Pebayuran Kab. Bekasi,2,0,0,0,0,2
Kec. Cabangbungin Kab. Bekasi,5,1,0,0,0,6
Kec. Muara Gembong Kab. Bekasi,0,0,0,0,0,0
Kec. Tambun Selatan Kab. Bekasi,33,7,0,0,0,40
Kec. Tambun Utara Kab. Bekasi,6,0,0,0,0,6
Kec. Cikarang Barat Kab. Bekasi,12,6,0,0,0,18
Kec. Karang Bahagia Kab. Bekasi,0,0,0,0,0,0
Kec. Cikarang Utara Kab. Bekasi,15,7,0,0,0,22
Kec. Cikarang Selatan Kab. Bekasi,14,0,0,0,0,14
Kec. Cikarang Timur Kab. Bekasi,4,0,0,0,0,4
Kec. Bojong Mangu Kab. Bekasi,2,0,0,0,0,2
Kec. Cikarang Pusat Kab. Bekasi,4,2,0,0,0,6
Kec. Sukakarya Kab. Bekasi,0,0,0,0,0,0
Kec. Sukawangi Kab. Bekasi,1,1,0,0,0,2
Kec. Serang Baru Kab. Bekasi,2,2,0,0,0,4
Kec. Salaman Kab. Magelang,3,1,0,0,0,4
Kec. Borobudur Kab. Magelang,0,2,0,0,0,2
Kec. Ngluwar Kab. Magelang,1,3,0,0,0,4
Kec. Salam Kab. Magelang,0,0,0,0,0,0
Kec. Srumbung Kab. Magelang,2,0,0,0,0,2
Kec. Dukun Kab. Magelang,1,1,0,0,0,2
Kec. Muntilan Kab. Magelang,12,0,0,0,0,12
Kec. Mungkid Kab. Magelang,6,0,0,0,0,6
Kec. Sawangan Kab. Magelang,2,0,0,0,0,2
Kec. Candimulyo Kab. Magelang,6,0,0,0,0,6
Kec. Mertoyudan Kab. Magelang,6,2,0,0,0,8
Kec. Tempuran Kab. Magelang,0,0,0,0,0,0
Kec. Kaliangkrik Kab. Magelang,0,0,0,0,0,0
Kec. Bandongan Kab. Magelang,1,3,0,0,0,4
Kec. Secang Kab. Magelang,3,5,0,0,0,8
Kec. Tegalrejo Kab. Magelang,0,0,0,0,0,0
Kec. Pakis Kab. Magelang,1,1,0,0,0,2
Kec. Grabag Kab. Magelang,6,2,0,0,0,8
Kec. Sumber Kab. Rembang,1,1,0,0,0,2
Kec. Sale Kab. Rembang,4,2,0,0,0,6
Kec. Sarang Kab. Rembang,0,2,0,0,0,2
Kec. Pamotan Kab. Rembang,0,4,0,0,0,4
Kec. Sulang Kab. Rembang,2,2,0,0,0,4
Kec. Kaliori Kab. Rembang,3,3,0,0,0,6
Kec. Rembang Kab. Rembang,4,2,0,0,0,6
Kec. Kragan Kab. Rembang,3,0,0,0,0,3
Kec. Sluke Kab. Rembang,2,2,0,0,0,4
Kec. Lasem Kab. Rembang,3,1,0,0,0,4
Kec. Sukolilo Kab. Pati,2,0,0,0,0,2
Kec. Kayen Kab. Pati,8,4,0,0,0,12
Kec. Batangan Kab. Pati,2,0,0,0,0,2
Kec. Juwana Kab. Pati,4,0,0,0,0,4
Kec. Jakenan Kab. Pati,2,0,0,0,0,2
Kec. Pati Kab. Pati,20,2,0,0,0,22
Kec. Gabus Kab. Pati,1,1,0,0,0,2
